{"id": "KB-URLLC-001", "nl_intent": "Urgent board meeting in Seoul on 2025-05-20 morning requires stable HD video conferencing for ten executives. Please ensure the session is prioritized with very low delay and no drops.", "target_json": {"serviceType": "URLLC", "sliceType": "URLLC-BoardMeeting", "latency": "<24ms", "throughput": "52Mbps", "region": "Seoul", "reliability": "99.972%", "priority": "1", "time": "2025-05-20"}, "tags": ["URLLC", "video-conference", "enterprise", "urgent", "Seoul"], "rationale": "This intent describes an urgent executive board meeting with HD video for a small group, where conversational smoothness and avoiding video or audio glitches are more important than raw data rate. Therefore the service is mapped to serviceType='URLLC' with sliceType='URLLC-BoardMeeting' to capture the need for very stable, time-sensitive media delivery. The latency target <24ms keeps end-to-end delay low enough for natural interaction, while throughput 52Mbps is sufficient for HD video and audio for around ten people. The required reliability of 99.972% reflects the expectation that the conference should not drop or reconnect. Region is set to 'Seoul' and time to '2025-05-20' as stated in the intent, and priority '1' expresses the highest scheduling priority compared with other traffic."}
{"id": "KB-URLLC-002", "nl_intent": "Remote surgery session in a top hospital in Suzhou on 2025-04-07 afternoon. The surgeon controls robotic arms over 6G, and the connection must be ultra-reliable with end-to-end latency of only a few milliseconds.", "target_json": {"serviceType": "URLLC", "sliceType": "URLLC-RemoteSurgery", "latency": "<5ms", "throughput": "45Mbps", "region": "Suzhou", "reliability": "99.951%", "priority": "1", "time": "2025-04-07"}, "tags": ["URLLC", "healthcare", "remote-surgery", "robotic-control", "Suzhou"], "rationale": "The intent explicitly refers to life-critical remote surgery with robotic arms, where even small delays or packet loss can directly affect patient safety. Hence the mapping to serviceType='URLLC' and sliceType='URLLC-RemoteSurgery'. The very small latency budget <5ms ensures that haptic feedback and tool movements feel instantaneous to the surgeon, and throughput 45Mbps is chosen to carry both control signals and high-quality video feeds of the operation. The reliability requirement 99.951% reflects mission-critical availability. Region 'Suzhou' and time '2025-04-07' are taken from the described hospital setting, and priority '1' indicates the highest scheduling priority compared with other traffic in the scheduler."}
{"id": "KB-URLLC-003", "nl_intent": "Highway autonomous driving test near Bangkok on 2025-05-14 will involve a fleet of self-driving trucks that exchange cooperative awareness messages. The service must guarantee millisecond-level latency and extremely high reliability for safety.", "target_json": {"serviceType": "URLLC", "sliceType": "URLLC-V2X-Highway", "latency": "<1ms", "throughput": "22Mbps", "region": "Bangkok", "reliability": "99.960%", "priority": "1", "time": "2025-05-14"}, "tags": ["URLLC", "V2X", "autonomous-driving", "highway", "Bangkok"], "rationale": "The scenario involves cooperative autonomous trucks on a highway, where vehicles share awareness messages to avoid collisions at high speed. This is a mission-critical use case for URLLC, so the intent is mapped to serviceType='URLLC' and sliceType='URLLC-V2X-Highway'. The latency constraint <1ms keeps reaction time within a few milliseconds, allowing the control logic in each vehicle to respond almost immediately. Throughput 22Mbps is sufficient for frequent status updates and sensor summaries rather than raw video. Reliability 99.960% captures the need for extremely rare message loss on safety-related links. The region 'Bangkok' and date '2025-05-14' follow the described test location and schedule, and priority '1' expresses the highest scheduling priority compared with other traffic compared to other network traffic."}
{"id": "KB-URLLC-004", "nl_intent": "Smart factory in Guangzhou will deploy coordinated robot arms and AGVs on 2025-01-14. Control loops require sub-10ms delay and virtually no packet loss.", "target_json": {"serviceType": "URLLC", "sliceType": "URLLC-IndustrialRobot", "latency": "<1ms", "throughput": "100Mbps", "region": "Guangzhou", "reliability": "99.950%", "priority": "1", "time": "2025-01-14"}, "tags": ["URLLC", "industrial", "factory", "robot", "AGV", "Guangzhou"], "rationale": "Here the intent targets coordinated robot arms and AGVs in a smart factory, which rely on tight control loops to synchronize motion and avoid collisions. The configuration therefore uses serviceType='URLLC' with sliceType='URLLC-IndustrialRobot'. The latency budget <1ms keeps the loop delay below the sub-10ms requirement, and throughput 100Mbps supports frequent state updates and commands among many devices. Reliability 99.950% is set high enough to prevent control interruptions that could halt production. Region 'Guangzhou' and time '2025-01-14' follow the deployment description, and priority '1' conveys the highest scheduling priority compared with other traffic."}
{"id": "KB-URLLC-005", "nl_intent": "Power grid protection signals in Suzhou must be transported over the network starting 2025-01-10. Fault detection and isolation messages require ultra-fast and reliable delivery.", "target_json": {"serviceType": "URLLC", "sliceType": "URLLC-SmartGridProtection", "latency": "<5ms", "throughput": "22Mbps", "region": "Suzhou", "reliability": "99.908%", "priority": "1", "time": "2025-01-10"}, "tags": ["URLLC", "smart-grid", "protection", "energy", "Suzhou"], "rationale": "The described service transports power grid protection and fault isolation signals, where delayed or lost messages can lead to cascading outages. As a result, the intent is mapped to serviceType='URLLC' and sliceType='URLLC-SmartGridProtection'. Latency <5ms keeps protection actions within a tight time window, and throughput 22Mbps is sufficient for short but frequent status and alarm messages. Reliability 99.908% ensures that almost all protection commands are delivered successfully. Region 'Suzhou' and time '2025-01-10' reflect the grid's deployment area and start date, and priority '1' encodes the highest scheduling priority compared with other traffic in the network."}
{"id": "KB-URLLC-006", "nl_intent": "During an emergency response drill in Shenzhen on 2025-04-09, a swarm of drones and rescue robots will exchange sensor data and control commands in real time. The network must support ultra-low latency and mission-critical reliability.", "target_json": {"serviceType": "URLLC", "sliceType": "URLLC-Drone-EmergencyResponse", "latency": "<1ms", "throughput": "84Mbps", "region": "Shenzhen", "reliability": "99.983%", "priority": "1", "time": "2025-04-09"}, "tags": ["URLLC", "emergency", "drone", "public-safety", "Shenzhen"], "rationale": "The intent mentions an emergency response drill with drones and rescue robots, where operators need real-time situational awareness and control in hazardous conditions. This motivates serviceType='URLLC' and sliceType='URLLC-Drone-EmergencyResponse'. The low latency target <1ms allows responsive maneuvering and coordination, and throughput 84Mbps is selected to carry compressed sensor streams and command traffic. The reliability level 99.983% reflects public-safety expectations for mission-critical communications. Region 'Shenzhen' and time '2025-04-09' are directly taken from the exercise description, and priority '1' denotes the highest scheduling priority compared with other traffic over ordinary services."}
{"id": "KB-URLLC-007", "nl_intent": "Smart factory in Bangkok will deploy coordinated robot arms and AGVs on 2025-05-14. Control loops require sub-10ms delay and virtually no packet loss.", "target_json": {"serviceType": "URLLC", "sliceType": "URLLC-IndustrialRobot", "latency": "<8ms", "throughput": "67Mbps", "region": "Bangkok", "reliability": "99.919%", "priority": "1", "time": "2025-05-14"}, "tags": ["URLLC", "industrial", "factory", "robot", "AGV", "Bangkok"], "rationale": "Here the intent targets coordinated robot arms and AGVs in a smart factory, which rely on tight control loops to synchronize motion and avoid collisions. The configuration therefore uses serviceType='URLLC' with sliceType='URLLC-IndustrialRobot'. The latency budget <8ms keeps the loop delay below the sub-10ms requirement, and throughput 67Mbps supports frequent state updates and commands among many devices. Reliability 99.919% is set high enough to prevent control interruptions that could halt production. Region 'Bangkok' and time '2025-05-14' follow the deployment description, and priority '1' conveys the highest scheduling priority compared with other traffic."}
{"id": "KB-URLLC-008", "nl_intent": "During an emergency response drill in Bangkok on 2025-01-26, a swarm of drones and rescue robots will exchange sensor data and control commands in real time. The network must support ultra-low latency and mission-critical reliability.", "target_json": {"serviceType": "URLLC", "sliceType": "URLLC-Drone-EmergencyResponse", "latency": "<2ms", "throughput": "70Mbps", "region": "Bangkok", "reliability": "99.990%", "priority": "1", "time": "2025-01-26"}, "tags": ["URLLC", "emergency", "drone", "public-safety", "Bangkok"], "rationale": "The intent mentions an emergency response drill with drones and rescue robots, where operators need real-time situational awareness and control in hazardous conditions. This motivates serviceType='URLLC' and sliceType='URLLC-Drone-EmergencyResponse'. The low latency target <2ms allows responsive maneuvering and coordination, and throughput 70Mbps is selected to carry compressed sensor streams and command traffic. The reliability level 99.990% reflects public-safety expectations for mission-critical communications. Region 'Bangkok' and time '2025-01-26' are directly taken from the exercise description, and priority '1' denotes the highest scheduling priority compared with other traffic over ordinary services."}
{"id": "KB-URLLC-009", "nl_intent": "Power grid protection signals in Xi'an must be transported over the network starting 2025-05-08. Fault detection and isolation messages require ultra-fast and reliable delivery.", "target_json": {"serviceType": "URLLC", "sliceType": "URLLC-SmartGridProtection", "latency": "<3ms", "throughput": "28Mbps", "region": "Xi'an", "reliability": "99.968%", "priority": "1", "time": "2025-05-08"}, "tags": ["URLLC", "smart-grid", "protection", "energy", "Xi'an"], "rationale": "The described service transports power grid protection and fault isolation signals, where delayed or lost messages can lead to cascading outages. As a result, the intent is mapped to serviceType='URLLC' and sliceType='URLLC-SmartGridProtection'. Latency <3ms keeps protection actions within a tight time window, and throughput 28Mbps is sufficient for short but frequent status and alarm messages. Reliability 99.968% ensures that almost all protection commands are delivered successfully. Region 'Xi'an' and time '2025-05-08' reflect the grid's deployment area and start date, and priority '1' encodes the highest scheduling priority compared with other traffic in the network."}
{"id": "KB-URLLC-010", "nl_intent": "During an emergency response drill in Shanghai on 2025-02-04, a swarm of drones and rescue robots will exchange sensor data and control commands in real time. The network must support ultra-low latency and mission-critical reliability.", "target_json": {"serviceType": "URLLC", "sliceType": "URLLC-Drone-EmergencyResponse", "latency": "<4ms", "throughput": "78Mbps", "region": "Shanghai", "reliability": "99.998%", "priority": "1", "time": "2025-02-04"}, "tags": ["URLLC", "emergency", "drone", "public-safety", "Shanghai"], "rationale": "The intent mentions an emergency response drill with drones and rescue robots, where operators need real-time situational awareness and control in hazardous conditions. This motivates serviceType='URLLC' and sliceType='URLLC-Drone-EmergencyResponse'. The low latency target <4ms allows responsive maneuvering and coordination, and throughput 78Mbps is selected to carry compressed sensor streams and command traffic. The reliability level 99.998% reflects public-safety expectations for mission-critical communications. Region 'Shanghai' and time '2025-02-04' are directly taken from the exercise description, and priority '1' denotes the highest scheduling priority compared with other traffic over ordinary services."}
{"id": "KB-URLLC-011", "nl_intent": "During an emergency response drill in Hangzhou on 2025-01-21, a swarm of drones and rescue robots will exchange sensor data and control commands in real time. The network must support ultra-low latency and mission-critical reliability.", "target_json": {"serviceType": "URLLC", "sliceType": "URLLC-Drone-EmergencyResponse", "latency": "<6ms", "throughput": "84Mbps", "region": "Hangzhou", "reliability": "99.961%", "priority": "1", "time": "2025-01-21"}, "tags": ["URLLC", "emergency", "drone", "public-safety", "Hangzhou"], "rationale": "The intent mentions an emergency response drill with drones and rescue robots, where operators need real-time situational awareness and control in hazardous conditions. This motivates serviceType='URLLC' and sliceType='URLLC-Drone-EmergencyResponse'. The low latency target <6ms allows responsive maneuvering and coordination, and throughput 84Mbps is selected to carry compressed sensor streams and command traffic. The reliability level 99.961% reflects public-safety expectations for mission-critical communications. Region 'Hangzhou' and time '2025-01-21' are directly taken from the exercise description, and priority '1' denotes the highest scheduling priority compared with other traffic over ordinary services."}
{"id": "KB-URLLC-012", "nl_intent": "Highway autonomous driving test near Tokyo on 2025-02-28 will involve a fleet of self-driving trucks that exchange cooperative awareness messages. The service must guarantee millisecond-level latency and extremely high reliability for safety.", "target_json": {"serviceType": "URLLC", "sliceType": "URLLC-V2X-Highway", "latency": "<6ms", "throughput": "22Mbps", "region": "Tokyo", "reliability": "99.969%", "priority": "1", "time": "2025-02-28"}, "tags": ["URLLC", "V2X", "autonomous-driving", "highway", "Tokyo"], "rationale": "The scenario involves cooperative autonomous trucks on a highway, where vehicles share awareness messages to avoid collisions at high speed. This is a mission-critical use case for URLLC, so the intent is mapped to serviceType='URLLC' and sliceType='URLLC-V2X-Highway'. The latency constraint <6ms keeps reaction time within a few milliseconds, allowing the control logic in each vehicle to respond almost immediately. Throughput 22Mbps is sufficient for frequent status updates and sensor summaries rather than raw video. Reliability 99.969% captures the need for extremely rare message loss on safety-related links. The region 'Tokyo' and date '2025-02-28' follow the described test location and schedule, and priority '1' expresses the highest scheduling priority compared with other traffic compared to other network traffic."}
{"id": "KB-URLLC-013", "nl_intent": "Highway autonomous driving test near Xi'an on 2025-03-19 will involve a fleet of self-driving trucks that exchange cooperative awareness messages. The service must guarantee millisecond-level latency and extremely high reliability for safety.", "target_json": {"serviceType": "URLLC", "sliceType": "URLLC-V2X-Highway", "latency": "<7ms", "throughput": "35Mbps", "region": "Xi'an", "reliability": "99.935%", "priority": "1", "time": "2025-03-19"}, "tags": ["URLLC", "V2X", "autonomous-driving", "highway", "Xi'an"], "rationale": "The scenario involves cooperative autonomous trucks on a highway, where vehicles share awareness messages to avoid collisions at high speed. This is a mission-critical use case for URLLC, so the intent is mapped to serviceType='URLLC' and sliceType='URLLC-V2X-Highway'. The latency constraint <7ms keeps reaction time within a few milliseconds, allowing the control logic in each vehicle to respond almost immediately. Throughput 35Mbps is sufficient for frequent status updates and sensor summaries rather than raw video. Reliability 99.935% captures the need for extremely rare message loss on safety-related links. The region 'Xi'an' and date '2025-03-19' follow the described test location and schedule, and priority '1' expresses the highest scheduling priority compared with other traffic compared to other network traffic."}
{"id": "KB-URLLC-014", "nl_intent": "Highway autonomous driving test near Beijing on 2025-01-25 will involve a fleet of self-driving trucks that exchange cooperative awareness messages. The service must guarantee millisecond-level latency and extremely high reliability for safety.", "target_json": {"serviceType": "URLLC", "sliceType": "URLLC-V2X-Highway", "latency": "<4ms", "throughput": "31Mbps", "region": "Beijing", "reliability": "99.907%", "priority": "1", "time": "2025-01-25"}, "tags": ["URLLC", "V2X", "autonomous-driving", "highway", "Beijing"], "rationale": "The scenario involves cooperative autonomous trucks on a highway, where vehicles share awareness messages to avoid collisions at high speed. This is a mission-critical use case for URLLC, so the intent is mapped to serviceType='URLLC' and sliceType='URLLC-V2X-Highway'. The latency constraint <4ms keeps reaction time within a few milliseconds, allowing the control logic in each vehicle to respond almost immediately. Throughput 31Mbps is sufficient for frequent status updates and sensor summaries rather than raw video. Reliability 99.907% captures the need for extremely rare message loss on safety-related links. The region 'Beijing' and date '2025-01-25' follow the described test location and schedule, and priority '1' expresses the highest scheduling priority compared with other traffic compared to other network traffic."}
{"id": "KB-URLLC-015", "nl_intent": "Highway autonomous driving test near Suzhou on 2025-01-28 will involve a fleet of self-driving trucks that exchange cooperative awareness messages. The service must guarantee millisecond-level latency and extremely high reliability for safety.", "target_json": {"serviceType": "URLLC", "sliceType": "URLLC-V2X-Highway", "latency": "<7ms", "throughput": "29Mbps", "region": "Suzhou", "reliability": "99.992%", "priority": "1", "time": "2025-01-28"}, "tags": ["URLLC", "V2X", "autonomous-driving", "highway", "Suzhou"], "rationale": "The scenario involves cooperative autonomous trucks on a highway, where vehicles share awareness messages to avoid collisions at high speed. This is a mission-critical use case for URLLC, so the intent is mapped to serviceType='URLLC' and sliceType='URLLC-V2X-Highway'. The latency constraint <7ms keeps reaction time within a few milliseconds, allowing the control logic in each vehicle to respond almost immediately. Throughput 29Mbps is sufficient for frequent status updates and sensor summaries rather than raw video. Reliability 99.992% captures the need for extremely rare message loss on safety-related links. The region 'Suzhou' and date '2025-01-28' follow the described test location and schedule, and priority '1' expresses the highest scheduling priority compared with other traffic compared to other network traffic."}
{"id": "KB-URLLC-016", "nl_intent": "Urgent board meeting in Xi'an on 2025-05-20 morning requires stable HD video conferencing for ten executives. Please ensure the session is prioritized with very low delay and no drops.", "target_json": {"serviceType": "URLLC", "sliceType": "URLLC-BoardMeeting", "latency": "<13ms", "throughput": "41Mbps", "region": "Xi'an", "reliability": "99.998%", "priority": "1", "time": "2025-05-20"}, "tags": ["URLLC", "video-conference", "enterprise", "urgent", "Xi'an"], "rationale": "This intent describes an urgent executive board meeting with HD video for a small group, where conversational smoothness and avoiding video or audio glitches are more important than raw data rate. Therefore the service is mapped to serviceType='URLLC' with sliceType='URLLC-BoardMeeting' to capture the need for very stable, time-sensitive media delivery. The latency target <13ms keeps end-to-end delay low enough for natural interaction, while throughput 41Mbps is sufficient for HD video and audio for around ten people. The required reliability of 99.998% reflects the expectation that the conference should not drop or reconnect. Region is set to 'Xi'an' and time to '2025-05-20' as stated in the intent, and priority '1' expresses the highest scheduling priority compared with other traffic."}
{"id": "KB-URLLC-017", "nl_intent": "Power grid protection signals in Shanghai must be transported over the network starting 2025-03-31. Fault detection and isolation messages require ultra-fast and reliable delivery.", "target_json": {"serviceType": "URLLC", "sliceType": "URLLC-SmartGridProtection", "latency": "<5ms", "throughput": "39Mbps", "region": "Shanghai", "reliability": "99.937%", "priority": "1", "time": "2025-03-31"}, "tags": ["URLLC", "smart-grid", "protection", "energy", "Shanghai"], "rationale": "The described service transports power grid protection and fault isolation signals, where delayed or lost messages can lead to cascading outages. As a result, the intent is mapped to serviceType='URLLC' and sliceType='URLLC-SmartGridProtection'. Latency <5ms keeps protection actions within a tight time window, and throughput 39Mbps is sufficient for short but frequent status and alarm messages. Reliability 99.937% ensures that almost all protection commands are delivered successfully. Region 'Shanghai' and time '2025-03-31' reflect the grid's deployment area and start date, and priority '1' encodes the highest scheduling priority compared with other traffic in the network."}
{"id": "KB-URLLC-018", "nl_intent": "During an emergency response drill in Suzhou on 2025-01-08, a swarm of drones and rescue robots will exchange sensor data and control commands in real time. The network must support ultra-low latency and mission-critical reliability.", "target_json": {"serviceType": "URLLC", "sliceType": "URLLC-Drone-EmergencyResponse", "latency": "<8ms", "throughput": "41Mbps", "region": "Suzhou", "reliability": "99.958%", "priority": "1", "time": "2025-01-08"}, "tags": ["URLLC", "emergency", "drone", "public-safety", "Suzhou"], "rationale": "The intent mentions an emergency response drill with drones and rescue robots, where operators need real-time situational awareness and control in hazardous conditions. This motivates serviceType='URLLC' and sliceType='URLLC-Drone-EmergencyResponse'. The low latency target <8ms allows responsive maneuvering and coordination, and throughput 41Mbps is selected to carry compressed sensor streams and command traffic. The reliability level 99.958% reflects public-safety expectations for mission-critical communications. Region 'Suzhou' and time '2025-01-08' are directly taken from the exercise description, and priority '1' denotes the highest scheduling priority compared with other traffic over ordinary services."}
{"id": "KB-URLLC-019", "nl_intent": "During an emergency response drill in Dubai on 2025-05-12, a swarm of drones and rescue robots will exchange sensor data and control commands in real time. The network must support ultra-low latency and mission-critical reliability.", "target_json": {"serviceType": "URLLC", "sliceType": "URLLC-Drone-EmergencyResponse", "latency": "<8ms", "throughput": "89Mbps", "region": "Dubai", "reliability": "99.947%", "priority": "1", "time": "2025-05-12"}, "tags": ["URLLC", "emergency", "drone", "public-safety", "Dubai"], "rationale": "The intent mentions an emergency response drill with drones and rescue robots, where operators need real-time situational awareness and control in hazardous conditions. This motivates serviceType='URLLC' and sliceType='URLLC-Drone-EmergencyResponse'. The low latency target <8ms allows responsive maneuvering and coordination, and throughput 89Mbps is selected to carry compressed sensor streams and command traffic. The reliability level 99.947% reflects public-safety expectations for mission-critical communications. Region 'Dubai' and time '2025-05-12' are directly taken from the exercise description, and priority '1' denotes the highest scheduling priority compared with other traffic over ordinary services."}
{"id": "KB-URLLC-020", "nl_intent": "Urgent board meeting in Chengdu on 2025-03-19 morning requires stable HD video conferencing for ten executives. Please ensure the session is prioritized with very low delay and no drops.", "target_json": {"serviceType": "URLLC", "sliceType": "URLLC-BoardMeeting", "latency": "<10ms", "throughput": "36Mbps", "region": "Chengdu", "reliability": "99.908%", "priority": "1", "time": "2025-03-19"}, "tags": ["URLLC", "video-conference", "enterprise", "urgent", "Chengdu"], "rationale": "This intent describes an urgent executive board meeting with HD video for a small group, where conversational smoothness and avoiding video or audio glitches are more important than raw data rate. Therefore the service is mapped to serviceType='URLLC' with sliceType='URLLC-BoardMeeting' to capture the need for very stable, time-sensitive media delivery. The latency target <10ms keeps end-to-end delay low enough for natural interaction, while throughput 36Mbps is sufficient for HD video and audio for around ten people. The required reliability of 99.908% reflects the expectation that the conference should not drop or reconnect. Region is set to 'Chengdu' and time to '2025-03-19' as stated in the intent, and priority '1' expresses the highest scheduling priority compared with other traffic."}
{"id": "KB-URLLC-021", "nl_intent": "Remote surgery session in a top hospital in Singapore on 2025-04-13 afternoon. The surgeon controls robotic arms over 6G, and the connection must be ultra-reliable with end-to-end latency of only a few milliseconds.", "target_json": {"serviceType": "URLLC", "sliceType": "URLLC-RemoteSurgery", "latency": "<2ms", "throughput": "58Mbps", "region": "Singapore", "reliability": "99.975%", "priority": "1", "time": "2025-04-13"}, "tags": ["URLLC", "healthcare", "remote-surgery", "robotic-control", "Singapore"], "rationale": "The intent explicitly refers to life-critical remote surgery with robotic arms, where even small delays or packet loss can directly affect patient safety. Hence the mapping to serviceType='URLLC' and sliceType='URLLC-RemoteSurgery'. The very small latency budget <2ms ensures that haptic feedback and tool movements feel instantaneous to the surgeon, and throughput 58Mbps is chosen to carry both control signals and high-quality video feeds of the operation. The reliability requirement 99.975% reflects mission-critical availability. Region 'Singapore' and time '2025-04-13' are taken from the described hospital setting, and priority '1' indicates the highest scheduling priority compared with other traffic in the scheduler."}
{"id": "KB-URLLC-022", "nl_intent": "Smart factory in Chengdu will deploy coordinated robot arms and AGVs on 2025-05-21. Control loops require sub-10ms delay and virtually no packet loss.", "target_json": {"serviceType": "URLLC", "sliceType": "URLLC-IndustrialRobot", "latency": "<6ms", "throughput": "70Mbps", "region": "Chengdu", "reliability": "99.960%", "priority": "1", "time": "2025-05-21"}, "tags": ["URLLC", "industrial", "factory", "robot", "AGV", "Chengdu"], "rationale": "Here the intent targets coordinated robot arms and AGVs in a smart factory, which rely on tight control loops to synchronize motion and avoid collisions. The configuration therefore uses serviceType='URLLC' with sliceType='URLLC-IndustrialRobot'. The latency budget <6ms keeps the loop delay below the sub-10ms requirement, and throughput 70Mbps supports frequent state updates and commands among many devices. Reliability 99.960% is set high enough to prevent control interruptions that could halt production. Region 'Chengdu' and time '2025-05-21' follow the deployment description, and priority '1' conveys the highest scheduling priority compared with other traffic."}
{"id": "KB-URLLC-023", "nl_intent": "Highway autonomous driving test near Bangkok on 2025-04-24 will involve a fleet of self-driving trucks that exchange cooperative awareness messages. The service must guarantee millisecond-level latency and extremely high reliability for safety.", "target_json": {"serviceType": "URLLC", "sliceType": "URLLC-V2X-Highway", "latency": "<8ms", "throughput": "76Mbps", "region": "Bangkok", "reliability": "99.920%", "priority": "1", "time": "2025-04-24"}, "tags": ["URLLC", "V2X", "autonomous-driving", "highway", "Bangkok"], "rationale": "The scenario involves cooperative autonomous trucks on a highway, where vehicles share awareness messages to avoid collisions at high speed. This is a mission-critical use case for URLLC, so the intent is mapped to serviceType='URLLC' and sliceType='URLLC-V2X-Highway'. The latency constraint <8ms keeps reaction time within a few milliseconds, allowing the control logic in each vehicle to respond almost immediately. Throughput 76Mbps is sufficient for frequent status updates and sensor summaries rather than raw video. Reliability 99.920% captures the need for extremely rare message loss on safety-related links. The region 'Bangkok' and date '2025-04-24' follow the described test location and schedule, and priority '1' expresses the highest scheduling priority compared with other traffic compared to other network traffic."}
{"id": "KB-URLLC-024", "nl_intent": "During an emergency response drill in London on 2025-01-18, a swarm of drones and rescue robots will exchange sensor data and control commands in real time. The network must support ultra-low latency and mission-critical reliability.", "target_json": {"serviceType": "URLLC", "sliceType": "URLLC-Drone-EmergencyResponse", "latency": "<5ms", "throughput": "88Mbps", "region": "London", "reliability": "99.908%", "priority": "1", "time": "2025-01-18"}, "tags": ["URLLC", "emergency", "drone", "public-safety", "London"], "rationale": "The intent mentions an emergency response drill with drones and rescue robots, where operators need real-time situational awareness and control in hazardous conditions. This motivates serviceType='URLLC' and sliceType='URLLC-Drone-EmergencyResponse'. The low latency target <5ms allows responsive maneuvering and coordination, and throughput 88Mbps is selected to carry compressed sensor streams and command traffic. The reliability level 99.908% reflects public-safety expectations for mission-critical communications. Region 'London' and time '2025-01-18' are directly taken from the exercise description, and priority '1' denotes the highest scheduling priority compared with other traffic over ordinary services."}
{"id": "KB-URLLC-025", "nl_intent": "Power grid protection signals in Nanjing must be transported over the network starting 2025-03-02. Fault detection and isolation messages require ultra-fast and reliable delivery.", "target_json": {"serviceType": "URLLC", "sliceType": "URLLC-SmartGridProtection", "latency": "<5ms", "throughput": "37Mbps", "region": "Nanjing", "reliability": "99.912%", "priority": "1", "time": "2025-03-02"}, "tags": ["URLLC", "smart-grid", "protection", "energy", "Nanjing"], "rationale": "The described service transports power grid protection and fault isolation signals, where delayed or lost messages can lead to cascading outages. As a result, the intent is mapped to serviceType='URLLC' and sliceType='URLLC-SmartGridProtection'. Latency <5ms keeps protection actions within a tight time window, and throughput 37Mbps is sufficient for short but frequent status and alarm messages. Reliability 99.912% ensures that almost all protection commands are delivered successfully. Region 'Nanjing' and time '2025-03-02' reflect the grid's deployment area and start date, and priority '1' encodes the highest scheduling priority compared with other traffic in the network."}
{"id": "KB-URLLC-026", "nl_intent": "During an emergency response drill in Hangzhou on 2025-03-21, a swarm of drones and rescue robots will exchange sensor data and control commands in real time. The network must support ultra-low latency and mission-critical reliability.", "target_json": {"serviceType": "URLLC", "sliceType": "URLLC-Drone-EmergencyResponse", "latency": "<6ms", "throughput": "119Mbps", "region": "Hangzhou", "reliability": "99.963%", "priority": "1", "time": "2025-03-21"}, "tags": ["URLLC", "emergency", "drone", "public-safety", "Hangzhou"], "rationale": "The intent mentions an emergency response drill with drones and rescue robots, where operators need real-time situational awareness and control in hazardous conditions. This motivates serviceType='URLLC' and sliceType='URLLC-Drone-EmergencyResponse'. The low latency target <6ms allows responsive maneuvering and coordination, and throughput 119Mbps is selected to carry compressed sensor streams and command traffic. The reliability level 99.963% reflects public-safety expectations for mission-critical communications. Region 'Hangzhou' and time '2025-03-21' are directly taken from the exercise description, and priority '1' denotes the highest scheduling priority compared with other traffic over ordinary services."}
{"id": "KB-URLLC-027", "nl_intent": "During an emergency response drill in Beijing on 2025-04-26, a swarm of drones and rescue robots will exchange sensor data and control commands in real time. The network must support ultra-low latency and mission-critical reliability.", "target_json": {"serviceType": "URLLC", "sliceType": "URLLC-Drone-EmergencyResponse", "latency": "<8ms", "throughput": "66Mbps", "region": "Beijing", "reliability": "99.919%", "priority": "1", "time": "2025-04-26"}, "tags": ["URLLC", "emergency", "drone", "public-safety", "Beijing"], "rationale": "The intent mentions an emergency response drill with drones and rescue robots, where operators need real-time situational awareness and control in hazardous conditions. This motivates serviceType='URLLC' and sliceType='URLLC-Drone-EmergencyResponse'. The low latency target <8ms allows responsive maneuvering and coordination, and throughput 66Mbps is selected to carry compressed sensor streams and command traffic. The reliability level 99.919% reflects public-safety expectations for mission-critical communications. Region 'Beijing' and time '2025-04-26' are directly taken from the exercise description, and priority '1' denotes the highest scheduling priority compared with other traffic over ordinary services."}
{"id": "KB-URLLC-028", "nl_intent": "During an emergency response drill in Dubai on 2025-05-31, a swarm of drones and rescue robots will exchange sensor data and control commands in real time. The network must support ultra-low latency and mission-critical reliability.", "target_json": {"serviceType": "URLLC", "sliceType": "URLLC-Drone-EmergencyResponse", "latency": "<5ms", "throughput": "114Mbps", "region": "Dubai", "reliability": "99.968%", "priority": "1", "time": "2025-05-31"}, "tags": ["URLLC", "emergency", "drone", "public-safety", "Dubai"], "rationale": "The intent mentions an emergency response drill with drones and rescue robots, where operators need real-time situational awareness and control in hazardous conditions. This motivates serviceType='URLLC' and sliceType='URLLC-Drone-EmergencyResponse'. The low latency target <5ms allows responsive maneuvering and coordination, and throughput 114Mbps is selected to carry compressed sensor streams and command traffic. The reliability level 99.968% reflects public-safety expectations for mission-critical communications. Region 'Dubai' and time '2025-05-31' are directly taken from the exercise description, and priority '1' denotes the highest scheduling priority compared with other traffic over ordinary services."}
{"id": "KB-URLLC-029", "nl_intent": "Urgent board meeting in Xi'an on 2025-05-03 morning requires stable HD video conferencing for ten executives. Please ensure the session is prioritized with very low delay and no drops.", "target_json": {"serviceType": "URLLC", "sliceType": "URLLC-BoardMeeting", "latency": "<12ms", "throughput": "21Mbps", "region": "Xi'an", "reliability": "99.944%", "priority": "1", "time": "2025-05-03"}, "tags": ["URLLC", "video-conference", "enterprise", "urgent", "Xi'an"], "rationale": "This intent describes an urgent executive board meeting with HD video for a small group, where conversational smoothness and avoiding video or audio glitches are more important than raw data rate. Therefore the service is mapped to serviceType='URLLC' with sliceType='URLLC-BoardMeeting' to capture the need for very stable, time-sensitive media delivery. The latency target <12ms keeps end-to-end delay low enough for natural interaction, while throughput 21Mbps is sufficient for HD video and audio for around ten people. The required reliability of 99.944% reflects the expectation that the conference should not drop or reconnect. Region is set to 'Xi'an' and time to '2025-05-03' as stated in the intent, and priority '1' expresses the highest scheduling priority compared with other traffic."}
{"id": "KB-URLLC-030", "nl_intent": "Highway autonomous driving test near Chengdu on 2025-02-24 will involve a fleet of self-driving trucks that exchange cooperative awareness messages. The service must guarantee millisecond-level latency and extremely high reliability for safety.", "target_json": {"serviceType": "URLLC", "sliceType": "URLLC-V2X-Highway", "latency": "<8ms", "throughput": "63Mbps", "region": "Chengdu", "reliability": "99.958%", "priority": "1", "time": "2025-02-24"}, "tags": ["URLLC", "V2X", "autonomous-driving", "highway", "Chengdu"], "rationale": "The scenario involves cooperative autonomous trucks on a highway, where vehicles share awareness messages to avoid collisions at high speed. This is a mission-critical use case for URLLC, so the intent is mapped to serviceType='URLLC' and sliceType='URLLC-V2X-Highway'. The latency constraint <8ms keeps reaction time within a few milliseconds, allowing the control logic in each vehicle to respond almost immediately. Throughput 63Mbps is sufficient for frequent status updates and sensor summaries rather than raw video. Reliability 99.958% captures the need for extremely rare message loss on safety-related links. The region 'Chengdu' and date '2025-02-24' follow the described test location and schedule, and priority '1' expresses the highest scheduling priority compared with other traffic compared to other network traffic."}
{"id": "KB-URLLC-031", "nl_intent": "During an emergency response drill in Tianjin on 2025-05-05, a swarm of drones and rescue robots will exchange sensor data and control commands in real time. The network must support ultra-low latency and mission-critical reliability.", "target_json": {"serviceType": "URLLC", "sliceType": "URLLC-Drone-EmergencyResponse", "latency": "<3ms", "throughput": "74Mbps", "region": "Tianjin", "reliability": "99.933%", "priority": "1", "time": "2025-05-05"}, "tags": ["URLLC", "emergency", "drone", "public-safety", "Tianjin"], "rationale": "The intent mentions an emergency response drill with drones and rescue robots, where operators need real-time situational awareness and control in hazardous conditions. This motivates serviceType='URLLC' and sliceType='URLLC-Drone-EmergencyResponse'. The low latency target <3ms allows responsive maneuvering and coordination, and throughput 74Mbps is selected to carry compressed sensor streams and command traffic. The reliability level 99.933% reflects public-safety expectations for mission-critical communications. Region 'Tianjin' and time '2025-05-05' are directly taken from the exercise description, and priority '1' denotes the highest scheduling priority compared with other traffic over ordinary services."}
{"id": "KB-URLLC-032", "nl_intent": "Remote surgery session in a top hospital in Suzhou on 2025-03-27 afternoon. The surgeon controls robotic arms over 6G, and the connection must be ultra-reliable with end-to-end latency of only a few milliseconds.", "target_json": {"serviceType": "URLLC", "sliceType": "URLLC-RemoteSurgery", "latency": "<5ms", "throughput": "67Mbps", "region": "Suzhou", "reliability": "99.950%", "priority": "1", "time": "2025-03-27"}, "tags": ["URLLC", "healthcare", "remote-surgery", "robotic-control", "Suzhou"], "rationale": "The intent explicitly refers to life-critical remote surgery with robotic arms, where even small delays or packet loss can directly affect patient safety. Hence the mapping to serviceType='URLLC' and sliceType='URLLC-RemoteSurgery'. The very small latency budget <5ms ensures that haptic feedback and tool movements feel instantaneous to the surgeon, and throughput 67Mbps is chosen to carry both control signals and high-quality video feeds of the operation. The reliability requirement 99.950% reflects mission-critical availability. Region 'Suzhou' and time '2025-03-27' are taken from the described hospital setting, and priority '1' indicates the highest scheduling priority compared with other traffic in the scheduler."}
{"id": "KB-eMBB-001", "nl_intent": "Large sports event in Chengdu on 2025-03-01 evening will provide 4K live streaming to spectators in the stadium. Thousands of fans will watch replays and multi-angle views on their phones.", "target_json": {"serviceType": "eMBB", "sliceType": "eMBB-4K-Event", "latency": "<37ms", "throughput": "887Mbps", "region": "Chengdu", "reliability": "98.66%", "priority": "2", "time": "2025-03-01"}, "tags": ["eMBB", "sports", "stadium", "live-streaming", "Chengdu"], "rationale": "The intent describes a stadium sports event with 4K live streaming and multi-angle replays for thousands of fans, which is dominated by high downlink video traffic. This naturally maps to serviceType='eMBB' and sliceType='eMBB-4K-Event'. The latency requirement <37ms is moderate, as a small buffering delay is acceptable, while throughput 887Mbps is provisioned high enough to serve many concurrent 4K streams. Reliability 98.66% is chosen to ensure smooth playback without frequent stalls. Region 'Chengdu' and time '2025-03-01' follow the event description, and priority '2' represents a relatively high priority for important but non life-critical services in the scheduler."}
{"id": "KB-eMBB-002", "nl_intent": "Global holographic townhall in Tokyo on 2025-01-29 will broadcast 8K volumetric video to remote offices. Participants wear AR headsets for immersive telepresence.", "target_json": {"serviceType": "eMBB", "sliceType": "eMBB-Holographic-Conference", "latency": "<33ms", "throughput": "1407Mbps", "region": "Tokyo", "reliability": "97.50%", "priority": "3", "time": "2025-01-29"}, "tags": ["eMBB", "enterprise", "holographic", "AR/VR", "Tokyo"], "rationale": "This scenario is an 8K holographic townhall with AR headsets, requiring extremely high data rates to render volumetric video in real time. Therefore it is mapped to serviceType='eMBB' and sliceType='eMBB-Holographic-Conference'. Latency <33ms is set to maintain interactive telepresence without being as strict as control traffic, and throughput 1407Mbps is allocated to sustain multiple 8K volumetric streams. Reliability 97.50% supports continuous media delivery. Region 'Tokyo' and time '2025-01-29' come from the townhall location, and priority '3' conveys a medium priority suitable for ordinary services among other enterprise traffic."}
{"id": "KB-eMBB-003", "nl_intent": "High-speed train passing through Dubai on 2025-02-22 should support uninterrupted cloud gaming and 4K video for passengers along the route.", "target_json": {"serviceType": "eMBB", "sliceType": "eMBB-HighSpeedTrain", "latency": "<27ms", "throughput": "732Mbps", "region": "Dubai", "reliability": "97.68%", "priority": "3", "time": "2025-02-22"}, "tags": ["eMBB", "transport", "train", "cloud-gaming", "Dubai"], "rationale": "The intent focuses on passenger entertainment on a high-speed train, combining cloud gaming and 4K video. This is a mobility-intensive broadband use case, so we select serviceType='eMBB' and sliceType='eMBB-HighSpeedTrain'. The latency bound <27ms is low enough to keep cloud gaming responsive, while throughput 732Mbps accounts for many concurrent users on board. Reliability 97.68% ensures sessions remain mostly stable despite frequent handovers. Region 'Dubai' and time '2025-02-22' capture the train segment, and priority '3' indicates a medium priority suitable for ordinary services compared with other services in the cell."}
{"id": "KB-eMBB-004", "nl_intent": "Campus in Beijing is upgrading to 6G on 2025-03-26 to support massive online classes, interactive labs, and AR-assisted teaching for students.", "target_json": {"serviceType": "eMBB", "sliceType": "eMBB-CampusBroadband", "latency": "<26ms", "throughput": "464Mbps", "region": "Beijing", "reliability": "97.60%", "priority": "3", "time": "2025-03-26"}, "tags": ["eMBB", "campus", "education", "hotspot", "Beijing"], "rationale": "The described service is a campus network carrying many online classes, interactive labs and AR-assisted teaching, which stresses high aggregate throughput more than ultra-low latency. Thus we configure serviceType='eMBB' with sliceType='eMBB-CampusBroadband'. Latency <26ms is acceptable for educational applications, while throughput 464Mbps provides capacity for large numbers of concurrent student sessions. Reliability 97.60% is set to keep connections generally stable during lectures. Region 'Beijing' and time '2025-03-26' are taken from the upgrade plan, and priority '3' reflects a medium priority suitable for ordinary services versus other slices in the campus."}
{"id": "KB-eMBB-005", "nl_intent": "International airport in Shanghai plans to offer high-capacity 6G hotspots in departure halls on 2025-03-12, serving roaming users with HD video streaming and large file downloads.", "target_json": {"serviceType": "eMBB", "sliceType": "eMBB-AirportHotspot", "latency": "<28ms", "throughput": "728Mbps", "region": "Shanghai", "reliability": "99.51%", "priority": "2", "time": "2025-03-12"}, "tags": ["eMBB", "airport", "hotspot", "roaming", "Shanghai"], "rationale": "Here the intent is to provide high-capacity hotspots in an airport departure hall for roaming users, focused on HD streaming and large file downloads. This is a typical enhanced mobile broadband service, so serviceType='eMBB' and sliceType='eMBB-AirportHotspot' are appropriate. Latency <28ms is modest since a short buffer is acceptable, whereas throughput 728Mbps is set high to sustain many simultaneous flows. Reliability 99.51% helps avoid frequent re-transmissions in a crowded environment. Region 'Shanghai' and time '2025-03-12' match the airport deployment, and priority '2' encodes a relatively high priority for important but non life-critical services relative to other airport services such as IoT or control channels."}
{"id": "KB-eMBB-006", "nl_intent": "High-speed train passing through Seoul on 2025-01-06 should support uninterrupted cloud gaming and 4K video for passengers along the route.", "target_json": {"serviceType": "eMBB", "sliceType": "eMBB-HighSpeedTrain", "latency": "<26ms", "throughput": "632Mbps", "region": "Seoul", "reliability": "97.11%", "priority": "2", "time": "2025-01-06"}, "tags": ["eMBB", "transport", "train", "cloud-gaming", "Seoul"], "rationale": "The intent focuses on passenger entertainment on a high-speed train, combining cloud gaming and 4K video. This is a mobility-intensive broadband use case, so we select serviceType='eMBB' and sliceType='eMBB-HighSpeedTrain'. The latency bound <26ms is low enough to keep cloud gaming responsive, while throughput 632Mbps accounts for many concurrent users on board. Reliability 97.11% ensures sessions remain mostly stable despite frequent handovers. Region 'Seoul' and time '2025-01-06' capture the train segment, and priority '2' indicates a relatively high priority for important but non life-critical services compared with other services in the cell."}
{"id": "KB-eMBB-007", "nl_intent": "International airport in Shenzhen plans to offer high-capacity 6G hotspots in departure halls on 2025-01-22, serving roaming users with HD video streaming and large file downloads.", "target_json": {"serviceType": "eMBB", "sliceType": "eMBB-AirportHotspot", "latency": "<27ms", "throughput": "1215Mbps", "region": "Shenzhen", "reliability": "99.62%", "priority": "3", "time": "2025-01-22"}, "tags": ["eMBB", "airport", "hotspot", "roaming", "Shenzhen"], "rationale": "Here the intent is to provide high-capacity hotspots in an airport departure hall for roaming users, focused on HD streaming and large file downloads. This is a typical enhanced mobile broadband service, so serviceType='eMBB' and sliceType='eMBB-AirportHotspot' are appropriate. Latency <27ms is modest since a short buffer is acceptable, whereas throughput 1215Mbps is set high to sustain many simultaneous flows. Reliability 99.62% helps avoid frequent re-transmissions in a crowded environment. Region 'Shenzhen' and time '2025-01-22' match the airport deployment, and priority '3' encodes a medium priority suitable for ordinary services relative to other airport services such as IoT or control channels."}
{"id": "KB-eMBB-008", "nl_intent": "International airport in Shenzhen plans to offer high-capacity 6G hotspots in departure halls on 2025-03-18, serving roaming users with HD video streaming and large file downloads.", "target_json": {"serviceType": "eMBB", "sliceType": "eMBB-AirportHotspot", "latency": "<34ms", "throughput": "836Mbps", "region": "Shenzhen", "reliability": "97.21%", "priority": "2", "time": "2025-03-18"}, "tags": ["eMBB", "airport", "hotspot", "roaming", "Shenzhen"], "rationale": "Here the intent is to provide high-capacity hotspots in an airport departure hall for roaming users, focused on HD streaming and large file downloads. This is a typical enhanced mobile broadband service, so serviceType='eMBB' and sliceType='eMBB-AirportHotspot' are appropriate. Latency <34ms is modest since a short buffer is acceptable, whereas throughput 836Mbps is set high to sustain many simultaneous flows. Reliability 97.21% helps avoid frequent re-transmissions in a crowded environment. Region 'Shenzhen' and time '2025-03-18' match the airport deployment, and priority '2' encodes a relatively high priority for important but non life-critical services relative to other airport services such as IoT or control channels."}
{"id": "KB-eMBB-009", "nl_intent": "Campus in Tokyo is upgrading to 6G on 2025-03-25 to support massive online classes, interactive labs, and AR-assisted teaching for students.", "target_json": {"serviceType": "eMBB", "sliceType": "eMBB-CampusBroadband", "latency": "<28ms", "throughput": "804Mbps", "region": "Tokyo", "reliability": "99.47%", "priority": "2", "time": "2025-03-25"}, "tags": ["eMBB", "campus", "education", "hotspot", "Tokyo"], "rationale": "The described service is a campus network carrying many online classes, interactive labs and AR-assisted teaching, which stresses high aggregate throughput more than ultra-low latency. Thus we configure serviceType='eMBB' with sliceType='eMBB-CampusBroadband'. Latency <28ms is acceptable for educational applications, while throughput 804Mbps provides capacity for large numbers of concurrent student sessions. Reliability 99.47% is set to keep connections generally stable during lectures. Region 'Tokyo' and time '2025-03-25' are taken from the upgrade plan, and priority '2' reflects a relatively high priority for important but non life-critical services versus other slices in the campus."}
{"id": "KB-eMBB-010", "nl_intent": "Large sports event in Xi'an on 2025-05-15 evening will provide 4K live streaming to spectators in the stadium. Thousands of fans will watch replays and multi-angle views on their phones.", "target_json": {"serviceType": "eMBB", "sliceType": "eMBB-4K-Event", "latency": "<36ms", "throughput": "605Mbps", "region": "Xi'an", "reliability": "99.72%", "priority": "2", "time": "2025-05-15"}, "tags": ["eMBB", "sports", "stadium", "live-streaming", "Xi'an"], "rationale": "The intent describes a stadium sports event with 4K live streaming and multi-angle replays for thousands of fans, which is dominated by high downlink video traffic. This naturally maps to serviceType='eMBB' and sliceType='eMBB-4K-Event'. The latency requirement <36ms is moderate, as a small buffering delay is acceptable, while throughput 605Mbps is provisioned high enough to serve many concurrent 4K streams. Reliability 99.72% is chosen to ensure smooth playback without frequent stalls. Region 'Xi'an' and time '2025-05-15' follow the event description, and priority '2' represents a relatively high priority for important but non life-critical services in the scheduler."}
{"id": "KB-eMBB-011", "nl_intent": "Large sports event in Bangkok on 2025-03-05 evening will provide 4K live streaming to spectators in the stadium. Thousands of fans will watch replays and multi-angle views on their phones.", "target_json": {"serviceType": "eMBB", "sliceType": "eMBB-4K-Event", "latency": "<32ms", "throughput": "800Mbps", "region": "Bangkok", "reliability": "97.68%", "priority": "3", "time": "2025-03-05"}, "tags": ["eMBB", "sports", "stadium", "live-streaming", "Bangkok"], "rationale": "The intent describes a stadium sports event with 4K live streaming and multi-angle replays for thousands of fans, which is dominated by high downlink video traffic. This naturally maps to serviceType='eMBB' and sliceType='eMBB-4K-Event'. The latency requirement <32ms is moderate, as a small buffering delay is acceptable, while throughput 800Mbps is provisioned high enough to serve many concurrent 4K streams. Reliability 97.68% is chosen to ensure smooth playback without frequent stalls. Region 'Bangkok' and time '2025-03-05' follow the event description, and priority '3' represents a medium priority suitable for ordinary services in the scheduler."}
{"id": "KB-eMBB-012", "nl_intent": "High-speed train passing through Wuhan on 2025-03-28 should support uninterrupted cloud gaming and 4K video for passengers along the route.", "target_json": {"serviceType": "eMBB", "sliceType": "eMBB-HighSpeedTrain", "latency": "<23ms", "throughput": "1009Mbps", "region": "Wuhan", "reliability": "97.10%", "priority": "3", "time": "2025-03-28"}, "tags": ["eMBB", "transport", "train", "cloud-gaming", "Wuhan"], "rationale": "The intent focuses on passenger entertainment on a high-speed train, combining cloud gaming and 4K video. This is a mobility-intensive broadband use case, so we select serviceType='eMBB' and sliceType='eMBB-HighSpeedTrain'. The latency bound <23ms is low enough to keep cloud gaming responsive, while throughput 1009Mbps accounts for many concurrent users on board. Reliability 97.10% ensures sessions remain mostly stable despite frequent handovers. Region 'Wuhan' and time '2025-03-28' capture the train segment, and priority '3' indicates a medium priority suitable for ordinary services compared with other services in the cell."}
{"id": "KB-eMBB-013", "nl_intent": "High-speed train passing through Suzhou on 2025-05-11 should support uninterrupted cloud gaming and 4K video for passengers along the route.", "target_json": {"serviceType": "eMBB", "sliceType": "eMBB-HighSpeedTrain", "latency": "<33ms", "throughput": "890Mbps", "region": "Suzhou", "reliability": "98.06%", "priority": "3", "time": "2025-05-11"}, "tags": ["eMBB", "transport", "train", "cloud-gaming", "Suzhou"], "rationale": "The intent focuses on passenger entertainment on a high-speed train, combining cloud gaming and 4K video. This is a mobility-intensive broadband use case, so we select serviceType='eMBB' and sliceType='eMBB-HighSpeedTrain'. The latency bound <33ms is low enough to keep cloud gaming responsive, while throughput 890Mbps accounts for many concurrent users on board. Reliability 98.06% ensures sessions remain mostly stable despite frequent handovers. Region 'Suzhou' and time '2025-05-11' capture the train segment, and priority '3' indicates a medium priority suitable for ordinary services compared with other services in the cell."}
{"id": "KB-eMBB-014", "nl_intent": "Campus in Shanghai is upgrading to 6G on 2025-05-20 to support massive online classes, interactive labs, and AR-assisted teaching for students.", "target_json": {"serviceType": "eMBB", "sliceType": "eMBB-CampusBroadband", "latency": "<29ms", "throughput": "690Mbps", "region": "Shanghai", "reliability": "97.09%", "priority": "2", "time": "2025-05-20"}, "tags": ["eMBB", "campus", "education", "hotspot", "Shanghai"], "rationale": "The described service is a campus network carrying many online classes, interactive labs and AR-assisted teaching, which stresses high aggregate throughput more than ultra-low latency. Thus we configure serviceType='eMBB' with sliceType='eMBB-CampusBroadband'. Latency <29ms is acceptable for educational applications, while throughput 690Mbps provides capacity for large numbers of concurrent student sessions. Reliability 97.09% is set to keep connections generally stable during lectures. Region 'Shanghai' and time '2025-05-20' are taken from the upgrade plan, and priority '2' reflects a relatively high priority for important but non life-critical services versus other slices in the campus."}
{"id": "KB-eMBB-015", "nl_intent": "Campus in Beijing is upgrading to 6G on 2025-01-02 to support massive online classes, interactive labs, and AR-assisted teaching for students.", "target_json": {"serviceType": "eMBB", "sliceType": "eMBB-CampusBroadband", "latency": "<37ms", "throughput": "671Mbps", "region": "Beijing", "reliability": "99.23%", "priority": "3", "time": "2025-01-02"}, "tags": ["eMBB", "campus", "education", "hotspot", "Beijing"], "rationale": "The described service is a campus network carrying many online classes, interactive labs and AR-assisted teaching, which stresses high aggregate throughput more than ultra-low latency. Thus we configure serviceType='eMBB' with sliceType='eMBB-CampusBroadband'. Latency <37ms is acceptable for educational applications, while throughput 671Mbps provides capacity for large numbers of concurrent student sessions. Reliability 99.23% is set to keep connections generally stable during lectures. Region 'Beijing' and time '2025-01-02' are taken from the upgrade plan, and priority '3' reflects a medium priority suitable for ordinary services versus other slices in the campus."}
{"id": "KB-eMBB-016", "nl_intent": "International airport in Guangzhou plans to offer high-capacity 6G hotspots in departure halls on 2025-04-24, serving roaming users with HD video streaming and large file downloads.", "target_json": {"serviceType": "eMBB", "sliceType": "eMBB-AirportHotspot", "latency": "<39ms", "throughput": "1091Mbps", "region": "Guangzhou", "reliability": "97.53%", "priority": "2", "time": "2025-04-24"}, "tags": ["eMBB", "airport", "hotspot", "roaming", "Guangzhou"], "rationale": "Here the intent is to provide high-capacity hotspots in an airport departure hall for roaming users, focused on HD streaming and large file downloads. This is a typical enhanced mobile broadband service, so serviceType='eMBB' and sliceType='eMBB-AirportHotspot' are appropriate. Latency <39ms is modest since a short buffer is acceptable, whereas throughput 1091Mbps is set high to sustain many simultaneous flows. Reliability 97.53% helps avoid frequent re-transmissions in a crowded environment. Region 'Guangzhou' and time '2025-04-24' match the airport deployment, and priority '2' encodes a relatively high priority for important but non life-critical services relative to other airport services such as IoT or control channels."}
{"id": "KB-eMBB-017", "nl_intent": "Campus in Seoul is upgrading to 6G on 2025-04-05 to support massive online classes, interactive labs, and AR-assisted teaching for students.", "target_json": {"serviceType": "eMBB", "sliceType": "eMBB-CampusBroadband", "latency": "<39ms", "throughput": "526Mbps", "region": "Seoul", "reliability": "99.06%", "priority": "2", "time": "2025-04-05"}, "tags": ["eMBB", "campus", "education", "hotspot", "Seoul"], "rationale": "The described service is a campus network carrying many online classes, interactive labs and AR-assisted teaching, which stresses high aggregate throughput more than ultra-low latency. Thus we configure serviceType='eMBB' with sliceType='eMBB-CampusBroadband'. Latency <39ms is acceptable for educational applications, while throughput 526Mbps provides capacity for large numbers of concurrent student sessions. Reliability 99.06% is set to keep connections generally stable during lectures. Region 'Seoul' and time '2025-04-05' are taken from the upgrade plan, and priority '2' reflects a relatively high priority for important but non life-critical services versus other slices in the campus."}
{"id": "KB-eMBB-018", "nl_intent": "International airport in Chengdu plans to offer high-capacity 6G hotspots in departure halls on 2025-03-07, serving roaming users with HD video streaming and large file downloads.", "target_json": {"serviceType": "eMBB", "sliceType": "eMBB-AirportHotspot", "latency": "<29ms", "throughput": "572Mbps", "region": "Chengdu", "reliability": "97.78%", "priority": "2", "time": "2025-03-07"}, "tags": ["eMBB", "airport", "hotspot", "roaming", "Chengdu"], "rationale": "Here the intent is to provide high-capacity hotspots in an airport departure hall for roaming users, focused on HD streaming and large file downloads. This is a typical enhanced mobile broadband service, so serviceType='eMBB' and sliceType='eMBB-AirportHotspot' are appropriate. Latency <29ms is modest since a short buffer is acceptable, whereas throughput 572Mbps is set high to sustain many simultaneous flows. Reliability 97.78% helps avoid frequent re-transmissions in a crowded environment. Region 'Chengdu' and time '2025-03-07' match the airport deployment, and priority '2' encodes a relatively high priority for important but non life-critical services relative to other airport services such as IoT or control channels."}
{"id": "KB-eMBB-019", "nl_intent": "Global holographic townhall in Beijing on 2025-05-04 will broadcast 8K volumetric video to remote offices. Participants wear AR headsets for immersive telepresence.", "target_json": {"serviceType": "eMBB", "sliceType": "eMBB-Holographic-Conference", "latency": "<31ms", "throughput": "1144Mbps", "region": "Beijing", "reliability": "99.26%", "priority": "3", "time": "2025-05-04"}, "tags": ["eMBB", "enterprise", "holographic", "AR/VR", "Beijing"], "rationale": "This scenario is an 8K holographic townhall with AR headsets, requiring extremely high data rates to render volumetric video in real time. Therefore it is mapped to serviceType='eMBB' and sliceType='eMBB-Holographic-Conference'. Latency <31ms is set to maintain interactive telepresence without being as strict as control traffic, and throughput 1144Mbps is allocated to sustain multiple 8K volumetric streams. Reliability 99.26% supports continuous media delivery. Region 'Beijing' and time '2025-05-04' come from the townhall location, and priority '3' conveys a medium priority suitable for ordinary services among other enterprise traffic."}
{"id": "KB-eMBB-020", "nl_intent": "Global holographic townhall in Dubai on 2025-01-19 will broadcast 8K volumetric video to remote offices. Participants wear AR headsets for immersive telepresence.", "target_json": {"serviceType": "eMBB", "sliceType": "eMBB-Holographic-Conference", "latency": "<25ms", "throughput": "940Mbps", "region": "Dubai", "reliability": "98.83%", "priority": "3", "time": "2025-01-19"}, "tags": ["eMBB", "enterprise", "holographic", "AR/VR", "Dubai"], "rationale": "This scenario is an 8K holographic townhall with AR headsets, requiring extremely high data rates to render volumetric video in real time. Therefore it is mapped to serviceType='eMBB' and sliceType='eMBB-Holographic-Conference'. Latency <25ms is set to maintain interactive telepresence without being as strict as control traffic, and throughput 940Mbps is allocated to sustain multiple 8K volumetric streams. Reliability 98.83% supports continuous media delivery. Region 'Dubai' and time '2025-01-19' come from the townhall location, and priority '3' conveys a medium priority suitable for ordinary services among other enterprise traffic."}
{"id": "KB-eMBB-021", "nl_intent": "International airport in Guangzhou plans to offer high-capacity 6G hotspots in departure halls on 2025-02-17, serving roaming users with HD video streaming and large file downloads.", "target_json": {"serviceType": "eMBB", "sliceType": "eMBB-AirportHotspot", "latency": "<34ms", "throughput": "1260Mbps", "region": "Guangzhou", "reliability": "98.62%", "priority": "3", "time": "2025-02-17"}, "tags": ["eMBB", "airport", "hotspot", "roaming", "Guangzhou"], "rationale": "Here the intent is to provide high-capacity hotspots in an airport departure hall for roaming users, focused on HD streaming and large file downloads. This is a typical enhanced mobile broadband service, so serviceType='eMBB' and sliceType='eMBB-AirportHotspot' are appropriate. Latency <34ms is modest since a short buffer is acceptable, whereas throughput 1260Mbps is set high to sustain many simultaneous flows. Reliability 98.62% helps avoid frequent re-transmissions in a crowded environment. Region 'Guangzhou' and time '2025-02-17' match the airport deployment, and priority '3' encodes a medium priority suitable for ordinary services relative to other airport services such as IoT or control channels."}
{"id": "KB-eMBB-022", "nl_intent": "International airport in Guangzhou plans to offer high-capacity 6G hotspots in departure halls on 2025-03-08, serving roaming users with HD video streaming and large file downloads.", "target_json": {"serviceType": "eMBB", "sliceType": "eMBB-AirportHotspot", "latency": "<26ms", "throughput": "920Mbps", "region": "Guangzhou", "reliability": "99.10%", "priority": "3", "time": "2025-03-08"}, "tags": ["eMBB", "airport", "hotspot", "roaming", "Guangzhou"], "rationale": "Here the intent is to provide high-capacity hotspots in an airport departure hall for roaming users, focused on HD streaming and large file downloads. This is a typical enhanced mobile broadband service, so serviceType='eMBB' and sliceType='eMBB-AirportHotspot' are appropriate. Latency <26ms is modest since a short buffer is acceptable, whereas throughput 920Mbps is set high to sustain many simultaneous flows. Reliability 99.10% helps avoid frequent re-transmissions in a crowded environment. Region 'Guangzhou' and time '2025-03-08' match the airport deployment, and priority '3' encodes a medium priority suitable for ordinary services relative to other airport services such as IoT or control channels."}
{"id": "KB-eMBB-023", "nl_intent": "High-speed train passing through Beijing on 2025-05-17 should support uninterrupted cloud gaming and 4K video for passengers along the route.", "target_json": {"serviceType": "eMBB", "sliceType": "eMBB-HighSpeedTrain", "latency": "<25ms", "throughput": "545Mbps", "region": "Beijing", "reliability": "99.36%", "priority": "3", "time": "2025-05-17"}, "tags": ["eMBB", "transport", "train", "cloud-gaming", "Beijing"], "rationale": "The intent focuses on passenger entertainment on a high-speed train, combining cloud gaming and 4K video. This is a mobility-intensive broadband use case, so we select serviceType='eMBB' and sliceType='eMBB-HighSpeedTrain'. The latency bound <25ms is low enough to keep cloud gaming responsive, while throughput 545Mbps accounts for many concurrent users on board. Reliability 99.36% ensures sessions remain mostly stable despite frequent handovers. Region 'Beijing' and time '2025-05-17' capture the train segment, and priority '3' indicates a medium priority suitable for ordinary services compared with other services in the cell."}
{"id": "KB-eMBB-025", "nl_intent": "Campus in Hangzhou is upgrading to 6G on 2025-04-27 to support massive online classes, interactive labs, and AR-assisted teaching for students.", "target_json": {"serviceType": "eMBB", "sliceType": "eMBB-CampusBroadband", "latency": "<33ms", "throughput": "469Mbps", "region": "Hangzhou", "reliability": "97.49%", "priority": "2", "time": "2025-04-27"}, "tags": ["eMBB", "campus", "education", "hotspot", "Hangzhou"], "rationale": "The described service is a campus network carrying many online classes, interactive labs and AR-assisted teaching, which stresses high aggregate throughput more than ultra-low latency. Thus we configure serviceType='eMBB' with sliceType='eMBB-CampusBroadband'. Latency <33ms is acceptable for educational applications, while throughput 469Mbps provides capacity for large numbers of concurrent student sessions. Reliability 97.49% is set to keep connections generally stable during lectures. Region 'Hangzhou' and time '2025-04-27' are taken from the upgrade plan, and priority '2' reflects a relatively high priority for important but non life-critical services versus other slices in the campus."}
{"id": "KB-eMBB-026", "nl_intent": "Large sports event in Wuhan on 2025-02-26 evening will provide 4K live streaming to spectators in the stadium. Thousands of fans will watch replays and multi-angle views on their phones.", "target_json": {"serviceType": "eMBB", "sliceType": "eMBB-4K-Event", "latency": "<35ms", "throughput": "999Mbps", "region": "Wuhan", "reliability": "97.09%", "priority": "2", "time": "2025-02-26"}, "tags": ["eMBB", "sports", "stadium", "live-streaming", "Wuhan"], "rationale": "The intent describes a stadium sports event with 4K live streaming and multi-angle replays for thousands of fans, which is dominated by high downlink video traffic. This naturally maps to serviceType='eMBB' and sliceType='eMBB-4K-Event'. The latency requirement <35ms is moderate, as a small buffering delay is acceptable, while throughput 999Mbps is provisioned high enough to serve many concurrent 4K streams. Reliability 97.09% is chosen to ensure smooth playback without frequent stalls. Region 'Wuhan' and time '2025-02-26' follow the event description, and priority '2' represents a relatively high priority for important but non life-critical services in the scheduler."}
{"id": "KB-eMBB-027", "nl_intent": "Campus in London is upgrading to 6G on 2025-03-08 to support massive online classes, interactive labs, and AR-assisted teaching for students.", "target_json": {"serviceType": "eMBB", "sliceType": "eMBB-CampusBroadband", "latency": "<40ms", "throughput": "401Mbps", "region": "London", "reliability": "97.23%", "priority": "3", "time": "2025-03-08"}, "tags": ["eMBB", "campus", "education", "hotspot", "London"], "rationale": "The described service is a campus network carrying many online classes, interactive labs and AR-assisted teaching, which stresses high aggregate throughput more than ultra-low latency. Thus we configure serviceType='eMBB' with sliceType='eMBB-CampusBroadband'. Latency <40ms is acceptable for educational applications, while throughput 401Mbps provides capacity for large numbers of concurrent student sessions. Reliability 97.23% is set to keep connections generally stable during lectures. Region 'London' and time '2025-03-08' are taken from the upgrade plan, and priority '3' reflects a medium priority suitable for ordinary services versus other slices in the campus."}
{"id": "KB-eMBB-028", "nl_intent": "International airport in Tokyo plans to offer high-capacity 6G hotspots in departure halls on 2025-01-15, serving roaming users with HD video streaming and large file downloads.", "target_json": {"serviceType": "eMBB", "sliceType": "eMBB-AirportHotspot", "latency": "<25ms", "throughput": "726Mbps", "region": "Tokyo", "reliability": "99.04%", "priority": "3", "time": "2025-01-15"}, "tags": ["eMBB", "airport", "hotspot", "roaming", "Tokyo"], "rationale": "Here the intent is to provide high-capacity hotspots in an airport departure hall for roaming users, focused on HD streaming and large file downloads. This is a typical enhanced mobile broadband service, so serviceType='eMBB' and sliceType='eMBB-AirportHotspot' are appropriate. Latency <25ms is modest since a short buffer is acceptable, whereas throughput 726Mbps is set high to sustain many simultaneous flows. Reliability 99.04% helps avoid frequent re-transmissions in a crowded environment. Region 'Tokyo' and time '2025-01-15' match the airport deployment, and priority '3' encodes a medium priority suitable for ordinary services relative to other airport services such as IoT or control channels."}
{"id": "KB-eMBB-029", "nl_intent": "Large sports event in Suzhou on 2025-03-22 evening will provide 4K live streaming to spectators in the stadium. Thousands of fans will watch replays and multi-angle views on their phones.", "target_json": {"serviceType": "eMBB", "sliceType": "eMBB-4K-Event", "latency": "<22ms", "throughput": "1223Mbps", "region": "Suzhou", "reliability": "97.55%", "priority": "2", "time": "2025-03-22"}, "tags": ["eMBB", "sports", "stadium", "live-streaming", "Suzhou"], "rationale": "The intent describes a stadium sports event with 4K live streaming and multi-angle replays for thousands of fans, which is dominated by high downlink video traffic. This naturally maps to serviceType='eMBB' and sliceType='eMBB-4K-Event'. The latency requirement <22ms is moderate, as a small buffering delay is acceptable, while throughput 1223Mbps is provisioned high enough to serve many concurrent 4K streams. Reliability 97.55% is chosen to ensure smooth playback without frequent stalls. Region 'Suzhou' and time '2025-03-22' follow the event description, and priority '2' represents a relatively high priority for important but non life-critical services in the scheduler."}
{"id": "KB-eMBB-030", "nl_intent": "Global holographic townhall in Hangzhou on 2025-01-10 will broadcast 8K volumetric video to remote offices. Participants wear AR headsets for immersive telepresence.", "target_json": {"serviceType": "eMBB", "sliceType": "eMBB-Holographic-Conference", "latency": "<28ms", "throughput": "1019Mbps", "region": "Hangzhou", "reliability": "98.04%", "priority": "2", "time": "2025-01-10"}, "tags": ["eMBB", "enterprise", "holographic", "AR/VR", "Hangzhou"], "rationale": "This scenario is an 8K holographic townhall with AR headsets, requiring extremely high data rates to render volumetric video in real time. Therefore it is mapped to serviceType='eMBB' and sliceType='eMBB-Holographic-Conference'. Latency <28ms is set to maintain interactive telepresence without being as strict as control traffic, and throughput 1019Mbps is allocated to sustain multiple 8K volumetric streams. Reliability 98.04% supports continuous media delivery. Region 'Hangzhou' and time '2025-01-10' come from the townhall location, and priority '2' conveys a relatively high priority for important but non life-critical services among other enterprise traffic."}
{"id": "KB-eMBB-031", "nl_intent": "International airport in London plans to offer high-capacity 6G hotspots in departure halls on 2025-01-07, serving roaming users with HD video streaming and large file downloads.", "target_json": {"serviceType": "eMBB", "sliceType": "eMBB-AirportHotspot", "latency": "<36ms", "throughput": "755Mbps", "region": "London", "reliability": "98.43%", "priority": "2", "time": "2025-01-07"}, "tags": ["eMBB", "airport", "hotspot", "roaming", "London"], "rationale": "Here the intent is to provide high-capacity hotspots in an airport departure hall for roaming users, focused on HD streaming and large file downloads. This is a typical enhanced mobile broadband service, so serviceType='eMBB' and sliceType='eMBB-AirportHotspot' are appropriate. Latency <36ms is modest since a short buffer is acceptable, whereas throughput 755Mbps is set high to sustain many simultaneous flows. Reliability 98.43% helps avoid frequent re-transmissions in a crowded environment. Region 'London' and time '2025-01-07' match the airport deployment, and priority '2' encodes a relatively high priority for important but non life-critical services relative to other airport services such as IoT or control channels."}
{"id": "KB-eMBB-032", "nl_intent": "International airport in Suzhou plans to offer high-capacity 6G hotspots in departure halls on 2025-02-01, serving roaming users with HD video streaming and large file downloads.", "target_json": {"serviceType": "eMBB", "sliceType": "eMBB-AirportHotspot", "latency": "<39ms", "throughput": "838Mbps", "region": "Suzhou", "reliability": "99.04%", "priority": "2", "time": "2025-02-01"}, "tags": ["eMBB", "airport", "hotspot", "roaming", "Suzhou"], "rationale": "Here the intent is to provide high-capacity hotspots in an airport departure hall for roaming users, focused on HD streaming and large file downloads. This is a typical enhanced mobile broadband service, so serviceType='eMBB' and sliceType='eMBB-AirportHotspot' are appropriate. Latency <39ms is modest since a short buffer is acceptable, whereas throughput 838Mbps is set high to sustain many simultaneous flows. Reliability 99.04% helps avoid frequent re-transmissions in a crowded environment. Region 'Suzhou' and time '2025-02-01' match the airport deployment, and priority '2' encodes a relatively high priority for important but non life-critical services relative to other airport services such as IoT or control channels."}
{"id": "KB-eMBB-033", "nl_intent": "Large sports event in Tianjin on 2025-03-04 evening will provide 4K live streaming to spectators in the stadium. Thousands of fans will watch replays and multi-angle views on their phones.", "target_json": {"serviceType": "eMBB", "sliceType": "eMBB-4K-Event", "latency": "<29ms", "throughput": "880Mbps", "region": "Tianjin", "reliability": "98.97%", "priority": "2", "time": "2025-03-04"}, "tags": ["eMBB", "sports", "stadium", "live-streaming", "Tianjin"], "rationale": "The intent describes a stadium sports event with 4K live streaming and multi-angle replays for thousands of fans, which is dominated by high downlink video traffic. This naturally maps to serviceType='eMBB' and sliceType='eMBB-4K-Event'. The latency requirement <29ms is moderate, as a small buffering delay is acceptable, while throughput 880Mbps is provisioned high enough to serve many concurrent 4K streams. Reliability 98.97% is chosen to ensure smooth playback without frequent stalls. Region 'Tianjin' and time '2025-03-04' follow the event description, and priority '2' represents a relatively high priority for important but non life-critical services in the scheduler."}
{"id": "KB-eMBB-034", "nl_intent": "Large sports event in Guangzhou on 2025-02-10 evening will provide 4K live streaming to spectators in the stadium. Thousands of fans will watch replays and multi-angle views on their phones.", "target_json": {"serviceType": "eMBB", "sliceType": "eMBB-4K-Event", "latency": "<39ms", "throughput": "1017Mbps", "region": "Guangzhou", "reliability": "97.20%", "priority": "2", "time": "2025-02-10"}, "tags": ["eMBB", "sports", "stadium", "live-streaming", "Guangzhou"], "rationale": "The intent describes a stadium sports event with 4K live streaming and multi-angle replays for thousands of fans, which is dominated by high downlink video traffic. This naturally maps to serviceType='eMBB' and sliceType='eMBB-4K-Event'. The latency requirement <39ms is moderate, as a small buffering delay is acceptable, while throughput 1017Mbps is provisioned high enough to serve many concurrent 4K streams. Reliability 97.20% is chosen to ensure smooth playback without frequent stalls. Region 'Guangzhou' and time '2025-02-10' follow the event description, and priority '2' represents a relatively high priority for important but non life-critical services in the scheduler."}
{"id": "KB-eMBB-035", "nl_intent": "Large sports event in Tianjin on 2025-03-14 evening will provide 4K live streaming to spectators in the stadium. Thousands of fans will watch replays and multi-angle views on their phones.", "target_json": {"serviceType": "eMBB", "sliceType": "eMBB-4K-Event", "latency": "<40ms", "throughput": "1228Mbps", "region": "Tianjin", "reliability": "98.68%", "priority": "3", "time": "2025-03-14"}, "tags": ["eMBB", "sports", "stadium", "live-streaming", "Tianjin"], "rationale": "The intent describes a stadium sports event with 4K live streaming and multi-angle replays for thousands of fans, which is dominated by high downlink video traffic. This naturally maps to serviceType='eMBB' and sliceType='eMBB-4K-Event'. The latency requirement <40ms is moderate, as a small buffering delay is acceptable, while throughput 1228Mbps is provisioned high enough to serve many concurrent 4K streams. Reliability 98.68% is chosen to ensure smooth playback without frequent stalls. Region 'Tianjin' and time '2025-03-14' follow the event description, and priority '3' represents a medium priority suitable for ordinary services in the scheduler."}
{"id": "KB-eMBB-036", "nl_intent": "Campus in Singapore is upgrading to 6G on 2025-05-12 to support massive online classes, interactive labs, and AR-assisted teaching for students.", "target_json": {"serviceType": "eMBB", "sliceType": "eMBB-CampusBroadband", "latency": "<38ms", "throughput": "519Mbps", "region": "Singapore", "reliability": "98.78%", "priority": "2", "time": "2025-05-12"}, "tags": ["eMBB", "campus", "education", "hotspot", "Singapore"], "rationale": "The described service is a campus network carrying many online classes, interactive labs and AR-assisted teaching, which stresses high aggregate throughput more than ultra-low latency. Thus we configure serviceType='eMBB' with sliceType='eMBB-CampusBroadband'. Latency <38ms is acceptable for educational applications, while throughput 519Mbps provides capacity for large numbers of concurrent student sessions. Reliability 98.78% is set to keep connections generally stable during lectures. Region 'Singapore' and time '2025-05-12' are taken from the upgrade plan, and priority '2' reflects a relatively high priority for important but non life-critical services versus other slices in the campus."}
{"id": "KB-eMBB-037", "nl_intent": "Campus in Guangzhou is upgrading to 6G on 2025-01-02 to support massive online classes, interactive labs, and AR-assisted teaching for students.", "target_json": {"serviceType": "eMBB", "sliceType": "eMBB-CampusBroadband", "latency": "<35ms", "throughput": "830Mbps", "region": "Guangzhou", "reliability": "99.20%", "priority": "2", "time": "2025-01-02"}, "tags": ["eMBB", "campus", "education", "hotspot", "Guangzhou"], "rationale": "The described service is a campus network carrying many online classes, interactive labs and AR-assisted teaching, which stresses high aggregate throughput more than ultra-low latency. Thus we configure serviceType='eMBB' with sliceType='eMBB-CampusBroadband'. Latency <35ms is acceptable for educational applications, while throughput 830Mbps provides capacity for large numbers of concurrent student sessions. Reliability 99.20% is set to keep connections generally stable during lectures. Region 'Guangzhou' and time '2025-01-02' are taken from the upgrade plan, and priority '2' reflects a relatively high priority for important but non life-critical services versus other slices in the campus."}
{"id": "KB-eMBB-038", "nl_intent": "Large sports event in Shanghai on 2025-04-09 evening will provide 4K live streaming to spectators in the stadium. Thousands of fans will watch replays and multi-angle views on their phones.", "target_json": {"serviceType": "eMBB", "sliceType": "eMBB-4K-Event", "latency": "<24ms", "throughput": "1124Mbps", "region": "Shanghai", "reliability": "97.46%", "priority": "3", "time": "2025-04-09"}, "tags": ["eMBB", "sports", "stadium", "live-streaming", "Shanghai"], "rationale": "The intent describes a stadium sports event with 4K live streaming and multi-angle replays for thousands of fans, which is dominated by high downlink video traffic. This naturally maps to serviceType='eMBB' and sliceType='eMBB-4K-Event'. The latency requirement <24ms is moderate, as a small buffering delay is acceptable, while throughput 1124Mbps is provisioned high enough to serve many concurrent 4K streams. Reliability 97.46% is chosen to ensure smooth playback without frequent stalls. Region 'Shanghai' and time '2025-04-09' follow the event description, and priority '3' represents a medium priority suitable for ordinary services in the scheduler."}
{"id": "KB-eMBB-039", "nl_intent": "Global holographic townhall in Xi'an on 2025-04-12 will broadcast 8K volumetric video to remote offices. Participants wear AR headsets for immersive telepresence.", "target_json": {"serviceType": "eMBB", "sliceType": "eMBB-Holographic-Conference", "latency": "<33ms", "throughput": "1048Mbps", "region": "Xi'an", "reliability": "99.49%", "priority": "2", "time": "2025-04-12"}, "tags": ["eMBB", "enterprise", "holographic", "AR/VR", "Xi'an"], "rationale": "This scenario is an 8K holographic townhall with AR headsets, requiring extremely high data rates to render volumetric video in real time. Therefore it is mapped to serviceType='eMBB' and sliceType='eMBB-Holographic-Conference'. Latency <33ms is set to maintain interactive telepresence without being as strict as control traffic, and throughput 1048Mbps is allocated to sustain multiple 8K volumetric streams. Reliability 99.49% supports continuous media delivery. Region 'Xi'an' and time '2025-04-12' come from the townhall location, and priority '2' conveys a relatively high priority for important but non life-critical services among other enterprise traffic."}
{"id": "KB-eMBB-040", "nl_intent": "Large sports event in Bangkok on 2025-02-05 evening will provide 4K live streaming to spectators in the stadium. Thousands of fans will watch replays and multi-angle views on their phones.", "target_json": {"serviceType": "eMBB", "sliceType": "eMBB-4K-Event", "latency": "<26ms", "throughput": "1465Mbps", "region": "Bangkok", "reliability": "99.59%", "priority": "3", "time": "2025-02-05"}, "tags": ["eMBB", "sports", "stadium", "live-streaming", "Bangkok"], "rationale": "The intent describes a stadium sports event with 4K live streaming and multi-angle replays for thousands of fans, which is dominated by high downlink video traffic. This naturally maps to serviceType='eMBB' and sliceType='eMBB-4K-Event'. The latency requirement <26ms is moderate, as a small buffering delay is acceptable, while throughput 1465Mbps is provisioned high enough to serve many concurrent 4K streams. Reliability 99.59% is chosen to ensure smooth playback without frequent stalls. Region 'Bangkok' and time '2025-02-05' follow the event description, and priority '3' represents a medium priority suitable for ordinary services in the scheduler."}
{"id": "KB-eMBB-041", "nl_intent": "International airport in Tokyo plans to offer high-capacity 6G hotspots in departure halls on 2025-01-23, serving roaming users with HD video streaming and large file downloads.", "target_json": {"serviceType": "eMBB", "sliceType": "eMBB-AirportHotspot", "latency": "<32ms", "throughput": "894Mbps", "region": "Tokyo", "reliability": "97.54%", "priority": "3", "time": "2025-01-23"}, "tags": ["eMBB", "airport", "hotspot", "roaming", "Tokyo"], "rationale": "Here the intent is to provide high-capacity hotspots in an airport departure hall for roaming users, focused on HD streaming and large file downloads. This is a typical enhanced mobile broadband service, so serviceType='eMBB' and sliceType='eMBB-AirportHotspot' are appropriate. Latency <32ms is modest since a short buffer is acceptable, whereas throughput 894Mbps is set high to sustain many simultaneous flows. Reliability 97.54% helps avoid frequent re-transmissions in a crowded environment. Region 'Tokyo' and time '2025-01-23' match the airport deployment, and priority '3' encodes a medium priority suitable for ordinary services relative to other airport services such as IoT or control channels."}
{"id": "KB-eMBB-042", "nl_intent": "Global holographic townhall in Bangkok on 2025-04-22 will broadcast 8K volumetric video to remote offices. Participants wear AR headsets for immersive telepresence.", "target_json": {"serviceType": "eMBB", "sliceType": "eMBB-Holographic-Conference", "latency": "<34ms", "throughput": "1051Mbps", "region": "Bangkok", "reliability": "99.50%", "priority": "2", "time": "2025-04-22"}, "tags": ["eMBB", "enterprise", "holographic", "AR/VR", "Bangkok"], "rationale": "This scenario is an 8K holographic townhall with AR headsets, requiring extremely high data rates to render volumetric video in real time. Therefore it is mapped to serviceType='eMBB' and sliceType='eMBB-Holographic-Conference'. Latency <34ms is set to maintain interactive telepresence without being as strict as control traffic, and throughput 1051Mbps is allocated to sustain multiple 8K volumetric streams. Reliability 99.50% supports continuous media delivery. Region 'Bangkok' and time '2025-04-22' come from the townhall location, and priority '2' conveys a relatively high priority for important but non life-critical services among other enterprise traffic."}
{"id": "KB-eMBB-043", "nl_intent": "High-speed train passing through Bangkok on 2025-02-27 should support uninterrupted cloud gaming and 4K video for passengers along the route.", "target_json": {"serviceType": "eMBB", "sliceType": "eMBB-HighSpeedTrain", "latency": "<32ms", "throughput": "663Mbps", "region": "Bangkok", "reliability": "99.80%", "priority": "2", "time": "2025-02-27"}, "tags": ["eMBB", "transport", "train", "cloud-gaming", "Bangkok"], "rationale": "The intent focuses on passenger entertainment on a high-speed train, combining cloud gaming and 4K video. This is a mobility-intensive broadband use case, so we select serviceType='eMBB' and sliceType='eMBB-HighSpeedTrain'. The latency bound <32ms is low enough to keep cloud gaming responsive, while throughput 663Mbps accounts for many concurrent users on board. Reliability 99.80% ensures sessions remain mostly stable despite frequent handovers. Region 'Bangkok' and time '2025-02-27' capture the train segment, and priority '2' indicates a relatively high priority for important but non life-critical services compared with other services in the cell."}
{"id": "KB-eMBB-044", "nl_intent": "Campus in Suzhou is upgrading to 6G on 2025-04-15 to support massive online classes, interactive labs, and AR-assisted teaching for students.", "target_json": {"serviceType": "eMBB", "sliceType": "eMBB-CampusBroadband", "latency": "<31ms", "throughput": "331Mbps", "region": "Suzhou", "reliability": "98.24%", "priority": "2", "time": "2025-04-15"}, "tags": ["eMBB", "campus", "education", "hotspot", "Suzhou"], "rationale": "The described service is a campus network carrying many online classes, interactive labs and AR-assisted teaching, which stresses high aggregate throughput more than ultra-low latency. Thus we configure serviceType='eMBB' with sliceType='eMBB-CampusBroadband'. Latency <31ms is acceptable for educational applications, while throughput 331Mbps provides capacity for large numbers of concurrent student sessions. Reliability 98.24% is set to keep connections generally stable during lectures. Region 'Suzhou' and time '2025-04-15' are taken from the upgrade plan, and priority '2' reflects a relatively high priority for important but non life-critical services versus other slices in the campus."}
{"id": "KB-eMBB-045", "nl_intent": "Global holographic townhall in Chengdu on 2025-02-12 will broadcast 8K volumetric video to remote offices. Participants wear AR headsets for immersive telepresence.", "target_json": {"serviceType": "eMBB", "sliceType": "eMBB-Holographic-Conference", "latency": "<26ms", "throughput": "1489Mbps", "region": "Chengdu", "reliability": "99.83%", "priority": "3", "time": "2025-02-12"}, "tags": ["eMBB", "enterprise", "holographic", "AR/VR", "Chengdu"], "rationale": "This scenario is an 8K holographic townhall with AR headsets, requiring extremely high data rates to render volumetric video in real time. Therefore it is mapped to serviceType='eMBB' and sliceType='eMBB-Holographic-Conference'. Latency <26ms is set to maintain interactive telepresence without being as strict as control traffic, and throughput 1489Mbps is allocated to sustain multiple 8K volumetric streams. Reliability 99.83% supports continuous media delivery. Region 'Chengdu' and time '2025-02-12' come from the townhall location, and priority '3' conveys a medium priority suitable for ordinary services among other enterprise traffic."}
{"id": "KB-eMBB-046", "nl_intent": "Campus in Seoul is upgrading to 6G on 2025-02-23 to support massive online classes, interactive labs, and AR-assisted teaching for students.", "target_json": {"serviceType": "eMBB", "sliceType": "eMBB-CampusBroadband", "latency": "<31ms", "throughput": "310Mbps", "region": "Seoul", "reliability": "98.57%", "priority": "2", "time": "2025-02-23"}, "tags": ["eMBB", "campus", "education", "hotspot", "Seoul"], "rationale": "The described service is a campus network carrying many online classes, interactive labs and AR-assisted teaching, which stresses high aggregate throughput more than ultra-low latency. Thus we configure serviceType='eMBB' with sliceType='eMBB-CampusBroadband'. Latency <31ms is acceptable for educational applications, while throughput 310Mbps provides capacity for large numbers of concurrent student sessions. Reliability 98.57% is set to keep connections generally stable during lectures. Region 'Seoul' and time '2025-02-23' are taken from the upgrade plan, and priority '2' reflects a relatively high priority for important but non life-critical services versus other slices in the campus."}
{"id": "KB-eMBB-047", "nl_intent": "Global holographic townhall in Chengdu on 2025-05-25 will broadcast 8K volumetric video to remote offices. Participants wear AR headsets for immersive telepresence.", "target_json": {"serviceType": "eMBB", "sliceType": "eMBB-Holographic-Conference", "latency": "<30ms", "throughput": "1466Mbps", "region": "Chengdu", "reliability": "98.08%", "priority": "2", "time": "2025-05-25"}, "tags": ["eMBB", "enterprise", "holographic", "AR/VR", "Chengdu"], "rationale": "This scenario is an 8K holographic townhall with AR headsets, requiring extremely high data rates to render volumetric video in real time. Therefore it is mapped to serviceType='eMBB' and sliceType='eMBB-Holographic-Conference'. Latency <30ms is set to maintain interactive telepresence without being as strict as control traffic, and throughput 1466Mbps is allocated to sustain multiple 8K volumetric streams. Reliability 98.08% supports continuous media delivery. Region 'Chengdu' and time '2025-05-25' come from the townhall location, and priority '2' conveys a relatively high priority for important but non life-critical services among other enterprise traffic."}
{"id": "KB-eMBB-048", "nl_intent": "Global holographic townhall in Suzhou on 2025-04-23 will broadcast 8K volumetric video to remote offices. Participants wear AR headsets for immersive telepresence.", "target_json": {"serviceType": "eMBB", "sliceType": "eMBB-Holographic-Conference", "latency": "<28ms", "throughput": "1398Mbps", "region": "Suzhou", "reliability": "98.42%", "priority": "2", "time": "2025-04-23"}, "tags": ["eMBB", "enterprise", "holographic", "AR/VR", "Suzhou"], "rationale": "This scenario is an 8K holographic townhall with AR headsets, requiring extremely high data rates to render volumetric video in real time. Therefore it is mapped to serviceType='eMBB' and sliceType='eMBB-Holographic-Conference'. Latency <28ms is set to maintain interactive telepresence without being as strict as control traffic, and throughput 1398Mbps is allocated to sustain multiple 8K volumetric streams. Reliability 98.42% supports continuous media delivery. Region 'Suzhou' and time '2025-04-23' come from the townhall location, and priority '2' conveys a relatively high priority for important but non life-critical services among other enterprise traffic."}
{"id": "KB-eMBB-049", "nl_intent": "International airport in Beijing plans to offer high-capacity 6G hotspots in departure halls on 2025-01-16, serving roaming users with HD video streaming and large file downloads.", "target_json": {"serviceType": "eMBB", "sliceType": "eMBB-AirportHotspot", "latency": "<26ms", "throughput": "1213Mbps", "region": "Beijing", "reliability": "97.39%", "priority": "2", "time": "2025-01-16"}, "tags": ["eMBB", "airport", "hotspot", "roaming", "Beijing"], "rationale": "Here the intent is to provide high-capacity hotspots in an airport departure hall for roaming users, focused on HD streaming and large file downloads. This is a typical enhanced mobile broadband service, so serviceType='eMBB' and sliceType='eMBB-AirportHotspot' are appropriate. Latency <26ms is modest since a short buffer is acceptable, whereas throughput 1213Mbps is set high to sustain many simultaneous flows. Reliability 97.39% helps avoid frequent re-transmissions in a crowded environment. Region 'Beijing' and time '2025-01-16' match the airport deployment, and priority '2' encodes a relatively high priority for important but non life-critical services relative to other airport services such as IoT or control channels."}
{"id": "KB-eMBB-050", "nl_intent": "Campus in Bangkok is upgrading to 6G on 2025-04-22 to support massive online classes, interactive labs, and AR-assisted teaching for students.", "target_json": {"serviceType": "eMBB", "sliceType": "eMBB-CampusBroadband", "latency": "<28ms", "throughput": "885Mbps", "region": "Bangkok", "reliability": "97.82%", "priority": "2", "time": "2025-04-22"}, "tags": ["eMBB", "campus", "education", "hotspot", "Bangkok"], "rationale": "The described service is a campus network carrying many online classes, interactive labs and AR-assisted teaching, which stresses high aggregate throughput more than ultra-low latency. Thus we configure serviceType='eMBB' with sliceType='eMBB-CampusBroadband'. Latency <28ms is acceptable for educational applications, while throughput 885Mbps provides capacity for large numbers of concurrent student sessions. Reliability 97.82% is set to keep connections generally stable during lectures. Region 'Bangkok' and time '2025-04-22' are taken from the upgrade plan, and priority '2' reflects a relatively high priority for important but non life-critical services versus other slices in the campus."}
{"id": "KB-eMBB-051", "nl_intent": "High-speed train passing through Tianjin on 2025-05-24 should support uninterrupted cloud gaming and 4K video for passengers along the route.", "target_json": {"serviceType": "eMBB", "sliceType": "eMBB-HighSpeedTrain", "latency": "<27ms", "throughput": "1082Mbps", "region": "Tianjin", "reliability": "97.20%", "priority": "3", "time": "2025-05-24"}, "tags": ["eMBB", "transport", "train", "cloud-gaming", "Tianjin"], "rationale": "The intent focuses on passenger entertainment on a high-speed train, combining cloud gaming and 4K video. This is a mobility-intensive broadband use case, so we select serviceType='eMBB' and sliceType='eMBB-HighSpeedTrain'. The latency bound <27ms is low enough to keep cloud gaming responsive, while throughput 1082Mbps accounts for many concurrent users on board. Reliability 97.20% ensures sessions remain mostly stable despite frequent handovers. Region 'Tianjin' and time '2025-05-24' capture the train segment, and priority '3' indicates a medium priority suitable for ordinary services compared with other services in the cell."}
{"id": "KB-eMBB-052", "nl_intent": "Campus in Beijing is upgrading to 6G on 2025-01-26 to support massive online classes, interactive labs, and AR-assisted teaching for students.", "target_json": {"serviceType": "eMBB", "sliceType": "eMBB-CampusBroadband", "latency": "<31ms", "throughput": "451Mbps", "region": "Beijing", "reliability": "98.75%", "priority": "2", "time": "2025-01-26"}, "tags": ["eMBB", "campus", "education", "hotspot", "Beijing"], "rationale": "The described service is a campus network carrying many online classes, interactive labs and AR-assisted teaching, which stresses high aggregate throughput more than ultra-low latency. Thus we configure serviceType='eMBB' with sliceType='eMBB-CampusBroadband'. Latency <31ms is acceptable for educational applications, while throughput 451Mbps provides capacity for large numbers of concurrent student sessions. Reliability 98.75% is set to keep connections generally stable during lectures. Region 'Beijing' and time '2025-01-26' are taken from the upgrade plan, and priority '2' reflects a relatively high priority for important but non life-critical services versus other slices in the campus."}
{"id": "KB-eMBB-053", "nl_intent": "Campus in Chengdu is upgrading to 6G on 2025-03-21 to support massive online classes, interactive labs, and AR-assisted teaching for students.", "target_json": {"serviceType": "eMBB", "sliceType": "eMBB-CampusBroadband", "latency": "<37ms", "throughput": "813Mbps", "region": "Chengdu", "reliability": "98.18%", "priority": "3", "time": "2025-03-21"}, "tags": ["eMBB", "campus", "education", "hotspot", "Chengdu"], "rationale": "The described service is a campus network carrying many online classes, interactive labs and AR-assisted teaching, which stresses high aggregate throughput more than ultra-low latency. Thus we configure serviceType='eMBB' with sliceType='eMBB-CampusBroadband'. Latency <37ms is acceptable for educational applications, while throughput 813Mbps provides capacity for large numbers of concurrent student sessions. Reliability 98.18% is set to keep connections generally stable during lectures. Region 'Chengdu' and time '2025-03-21' are taken from the upgrade plan, and priority '3' reflects a medium priority suitable for ordinary services versus other slices in the campus."}
{"id": "KB-eMBB-054", "nl_intent": "Large sports event in Xi'an on 2025-01-25 evening will provide 4K live streaming to spectators in the stadium. Thousands of fans will watch replays and multi-angle views on their phones.", "target_json": {"serviceType": "eMBB", "sliceType": "eMBB-4K-Event", "latency": "<30ms", "throughput": "1265Mbps", "region": "Xi'an", "reliability": "99.11%", "priority": "3", "time": "2025-01-25"}, "tags": ["eMBB", "sports", "stadium", "live-streaming", "Xi'an"], "rationale": "The intent describes a stadium sports event with 4K live streaming and multi-angle replays for thousands of fans, which is dominated by high downlink video traffic. This naturally maps to serviceType='eMBB' and sliceType='eMBB-4K-Event'. The latency requirement <30ms is moderate, as a small buffering delay is acceptable, while throughput 1265Mbps is provisioned high enough to serve many concurrent 4K streams. Reliability 99.11% is chosen to ensure smooth playback without frequent stalls. Region 'Xi'an' and time '2025-01-25' follow the event description, and priority '3' represents a medium priority suitable for ordinary services in the scheduler."}
{"id": "KB-eMBB-055", "nl_intent": "International airport in Beijing plans to offer high-capacity 6G hotspots in departure halls on 2025-03-05, serving roaming users with HD video streaming and large file downloads.", "target_json": {"serviceType": "eMBB", "sliceType": "eMBB-AirportHotspot", "latency": "<40ms", "throughput": "660Mbps", "region": "Beijing", "reliability": "97.65%", "priority": "2", "time": "2025-03-05"}, "tags": ["eMBB", "airport", "hotspot", "roaming", "Beijing"], "rationale": "Here the intent is to provide high-capacity hotspots in an airport departure hall for roaming users, focused on HD streaming and large file downloads. This is a typical enhanced mobile broadband service, so serviceType='eMBB' and sliceType='eMBB-AirportHotspot' are appropriate. Latency <40ms is modest since a short buffer is acceptable, whereas throughput 660Mbps is set high to sustain many simultaneous flows. Reliability 97.65% helps avoid frequent re-transmissions in a crowded environment. Region 'Beijing' and time '2025-03-05' match the airport deployment, and priority '2' encodes a relatively high priority for important but non life-critical services relative to other airport services such as IoT or control channels."}
{"id": "KB-eMBB-056", "nl_intent": "Global holographic townhall in Singapore on 2025-01-10 will broadcast 8K volumetric video to remote offices. Participants wear AR headsets for immersive telepresence.", "target_json": {"serviceType": "eMBB", "sliceType": "eMBB-Holographic-Conference", "latency": "<30ms", "throughput": "1429Mbps", "region": "Singapore", "reliability": "97.96%", "priority": "3", "time": "2025-01-10"}, "tags": ["eMBB", "enterprise", "holographic", "AR/VR", "Singapore"], "rationale": "This scenario is an 8K holographic townhall with AR headsets, requiring extremely high data rates to render volumetric video in real time. Therefore it is mapped to serviceType='eMBB' and sliceType='eMBB-Holographic-Conference'. Latency <30ms is set to maintain interactive telepresence without being as strict as control traffic, and throughput 1429Mbps is allocated to sustain multiple 8K volumetric streams. Reliability 97.96% supports continuous media delivery. Region 'Singapore' and time '2025-01-10' come from the townhall location, and priority '3' conveys a medium priority suitable for ordinary services among other enterprise traffic."}
{"id": "KB-eMBB-057", "nl_intent": "Global holographic townhall in Chengdu on 2025-05-24 will broadcast 8K volumetric video to remote offices. Participants wear AR headsets for immersive telepresence.", "target_json": {"serviceType": "eMBB", "sliceType": "eMBB-Holographic-Conference", "latency": "<24ms", "throughput": "999Mbps", "region": "Chengdu", "reliability": "98.10%", "priority": "3", "time": "2025-05-24"}, "tags": ["eMBB", "enterprise", "holographic", "AR/VR", "Chengdu"], "rationale": "This scenario is an 8K holographic townhall with AR headsets, requiring extremely high data rates to render volumetric video in real time. Therefore it is mapped to serviceType='eMBB' and sliceType='eMBB-Holographic-Conference'. Latency <24ms is set to maintain interactive telepresence without being as strict as control traffic, and throughput 999Mbps is allocated to sustain multiple 8K volumetric streams. Reliability 98.10% supports continuous media delivery. Region 'Chengdu' and time '2025-05-24' come from the townhall location, and priority '3' conveys a medium priority suitable for ordinary services among other enterprise traffic."}
{"id": "KB-eMBB-058", "nl_intent": "Large sports event in Seoul on 2025-01-19 evening will provide 4K live streaming to spectators in the stadium. Thousands of fans will watch replays and multi-angle views on their phones.", "target_json": {"serviceType": "eMBB", "sliceType": "eMBB-4K-Event", "latency": "<32ms", "throughput": "1421Mbps", "region": "Seoul", "reliability": "98.76%", "priority": "3", "time": "2025-01-19"}, "tags": ["eMBB", "sports", "stadium", "live-streaming", "Seoul"], "rationale": "The intent describes a stadium sports event with 4K live streaming and multi-angle replays for thousands of fans, which is dominated by high downlink video traffic. This naturally maps to serviceType='eMBB' and sliceType='eMBB-4K-Event'. The latency requirement <32ms is moderate, as a small buffering delay is acceptable, while throughput 1421Mbps is provisioned high enough to serve many concurrent 4K streams. Reliability 98.76% is chosen to ensure smooth playback without frequent stalls. Region 'Seoul' and time '2025-01-19' follow the event description, and priority '3' represents a medium priority suitable for ordinary services in the scheduler."}
{"id": "KB-eMBB-059", "nl_intent": "International airport in London plans to offer high-capacity 6G hotspots in departure halls on 2025-04-01, serving roaming users with HD video streaming and large file downloads.", "target_json": {"serviceType": "eMBB", "sliceType": "eMBB-AirportHotspot", "latency": "<29ms", "throughput": "773Mbps", "region": "London", "reliability": "97.72%", "priority": "2", "time": "2025-04-01"}, "tags": ["eMBB", "airport", "hotspot", "roaming", "London"], "rationale": "Here the intent is to provide high-capacity hotspots in an airport departure hall for roaming users, focused on HD streaming and large file downloads. This is a typical enhanced mobile broadband service, so serviceType='eMBB' and sliceType='eMBB-AirportHotspot' are appropriate. Latency <29ms is modest since a short buffer is acceptable, whereas throughput 773Mbps is set high to sustain many simultaneous flows. Reliability 97.72% helps avoid frequent re-transmissions in a crowded environment. Region 'London' and time '2025-04-01' match the airport deployment, and priority '2' encodes a relatively high priority for important but non life-critical services relative to other airport services such as IoT or control channels."}
{"id": "KB-eMBB-060", "nl_intent": "Global holographic townhall in Tokyo on 2025-03-04 will broadcast 8K volumetric video to remote offices. Participants wear AR headsets for immersive telepresence.", "target_json": {"serviceType": "eMBB", "sliceType": "eMBB-Holographic-Conference", "latency": "<30ms", "throughput": "1133Mbps", "region": "Tokyo", "reliability": "98.40%", "priority": "3", "time": "2025-03-04"}, "tags": ["eMBB", "enterprise", "holographic", "AR/VR", "Tokyo"], "rationale": "This scenario is an 8K holographic townhall with AR headsets, requiring extremely high data rates to render volumetric video in real time. Therefore it is mapped to serviceType='eMBB' and sliceType='eMBB-Holographic-Conference'. Latency <30ms is set to maintain interactive telepresence without being as strict as control traffic, and throughput 1133Mbps is allocated to sustain multiple 8K volumetric streams. Reliability 98.40% supports continuous media delivery. Region 'Tokyo' and time '2025-03-04' come from the townhall location, and priority '3' conveys a medium priority suitable for ordinary services among other enterprise traffic."}
{"id": "KB-mMTC-001", "nl_intent": "City-wide smart metering rollout in Seoul starting 2025-01-27 will connect tens of thousands of electricity meters. Each meter periodically reports consumption data.", "target_json": {"serviceType": "mMTC", "sliceType": "mMTC-SmartMetering", "latency": "<146ms", "throughput": "0.45Mbps", "region": "Seoul", "reliability": "98.34%", "priority": "3", "time": "2025-01-27"}, "tags": ["mMTC", "smart-meter", "utility", "AMI", "Seoul"], "rationale": "This intent covers a smart metering rollout with tens of thousands of electricity meters sending periodic reports. The traffic consists of small, delay-tolerant packets, so the service is mapped to serviceType='mMTC' and sliceType='mMTC-SmartMetering'. Latency <146ms is relaxed because a delay of seconds does not impact billing, while per-device throughput 0.45Mbps matches occasional meter readings. Reliability 98.34% is adequate when combined with retransmissions over many reporting intervals. Region 'Seoul' and time '2025-01-27' follow the city-wide deployment plan, and priority '3' expresses a medium priority suitable for ordinary services since this telemetry can be deferred behind more urgent traffic."}
{"id": "KB-mMTC-002", "nl_intent": "Smart agriculture project outside Beijing from 2025-04-19 will connect soil moisture sensors and climate stations across large fields.", "target_json": {"serviceType": "mMTC", "sliceType": "mMTC-Agriculture", "latency": "<139ms", "throughput": "0.62Mbps", "region": "Beijing", "reliability": "99.05%", "priority": "5", "time": "2025-04-19"}, "tags": ["mMTC", "agriculture", "sensor-network", "Beijing"], "rationale": "The scenario is a smart agriculture deployment with soil and climate sensors spread over large fields. These devices send low-rate measurements, making serviceType='mMTC' with sliceType='mMTC-Agriculture' a natural choice. Latency <139ms can be high because farming decisions are not made in milliseconds, and throughput 0.62Mbps corresponds to sporadic sensor updates. Reliability 99.05% is sufficient when multiple readings over time are available. Region 'Beijing' and time '2025-04-19' represent the farming area and start date, and priority '5' reflects a lower priority appropriate for delay-tolerant background services compared to human-centric services."}
{"id": "KB-mMTC-003", "nl_intent": "Urban smart parking system in Bangkok will deploy ground sensors and cameras starting 2025-03-09. Devices occasionally upload occupancy information.", "target_json": {"serviceType": "mMTC", "sliceType": "mMTC-SmartParking", "latency": "<91ms", "throughput": "0.22Mbps", "region": "Bangkok", "reliability": "97.44%", "priority": "3", "time": "2025-03-09"}, "tags": ["mMTC", "parking", "smart-city", "Bangkok"], "rationale": "The intent describes an urban smart parking system where sensors occasionally report whether spaces are occupied. This leads to serviceType='mMTC' and sliceType='mMTC-SmartParking', since message sizes are small and not time-critical to the millisecond. Latency <91ms allows for some delay before the app updates availability, and per-device throughput 0.22Mbps remains very low. Reliability 97.44% is adequate when parking status can be re-sent if needed. Region 'Bangkok' and time '2025-03-09' reference the city deployment, and priority '3' denotes a medium priority suitable for ordinary services because these updates can yield to more urgent flows."}
{"id": "KB-mMTC-004", "nl_intent": "Logistics company in Singapore will attach low-power trackers to thousands of containers and pallets from 2025-05-21, sending infrequent location updates.", "target_json": {"serviceType": "mMTC", "sliceType": "mMTC-LogisticsTracking", "latency": "<191ms", "throughput": "0.33Mbps", "region": "Singapore", "reliability": "98.81%", "priority": "5", "time": "2025-05-21"}, "tags": ["mMTC", "logistics", "asset-tracking", "Singapore"], "rationale": "This case concerns low-power trackers on containers and pallets that send infrequent location updates. Such sparse, low-volume traffic is characteristic of mMTC, so serviceType='mMTC' and sliceType='mMTC-LogisticsTracking' are selected. Latency <191ms is non-critical because logistics can tolerate delayed visibility, and throughput 0.33Mbps matches small GPS reports. Reliability 98.81% is acceptable when occasional missed updates are compensated by later ones. Region 'Singapore' and time '2025-05-21' follow the logistics operation, and priority '5' expresses a lower priority appropriate for delay-tolerant background services relative to interactive applications."}
{"id": "KB-mMTC-005", "nl_intent": "Industrial park in Chengdu plans dense deployment of environmental sensors on 2025-04-28 to monitor air quality, temperature and humidity in real time.", "target_json": {"serviceType": "mMTC", "sliceType": "mMTC-EnvironmentalSensing", "latency": "<139ms", "throughput": "0.97Mbps", "region": "Chengdu", "reliability": "98.52%", "priority": "3", "time": "2025-04-28"}, "tags": ["mMTC", "environment", "sensing", "Chengdu"], "rationale": "The described deployment uses dense environmental sensors in an industrial park, measuring air quality, temperature and humidity. Despite 'real-time' wording, the data volume per device is small, so serviceType='mMTC' and sliceType='mMTC-EnvironmentalSensing' are chosen. Latency <139ms is still on the order of hundreds of milliseconds, which is enough for monitoring dashboards, and throughput 0.97Mbps fits continuous but low-rate measurements. Reliability 98.52% balances cost and sensing accuracy. Region 'Chengdu' and time '2025-04-28' come from the monitoring plan, and priority '3' indicates a medium priority suitable for ordinary services compared with strict QoS slices."}
{"id": "KB-mMTC-006", "nl_intent": "Urban smart parking system in Dubai will deploy ground sensors and cameras starting 2025-04-30. Devices occasionally upload occupancy information.", "target_json": {"serviceType": "mMTC", "sliceType": "mMTC-SmartParking", "latency": "<165ms", "throughput": "0.55Mbps", "region": "Dubai", "reliability": "96.80%", "priority": "5", "time": "2025-04-30"}, "tags": ["mMTC", "parking", "smart-city", "Dubai"], "rationale": "The intent describes an urban smart parking system where sensors occasionally report whether spaces are occupied. This leads to serviceType='mMTC' and sliceType='mMTC-SmartParking', since message sizes are small and not time-critical to the millisecond. Latency <165ms allows for some delay before the app updates availability, and per-device throughput 0.55Mbps remains very low. Reliability 96.80% is adequate when parking status can be re-sent if needed. Region 'Dubai' and time '2025-04-30' reference the city deployment, and priority '5' denotes a lower priority appropriate for delay-tolerant background services because these updates can yield to more urgent flows."}
{"id": "KB-mMTC-007", "nl_intent": "Logistics company in Singapore will attach low-power trackers to thousands of containers and pallets from 2025-04-09, sending infrequent location updates.", "target_json": {"serviceType": "mMTC", "sliceType": "mMTC-LogisticsTracking", "latency": "<151ms", "throughput": "0.09Mbps", "region": "Singapore", "reliability": "97.73%", "priority": "5", "time": "2025-04-09"}, "tags": ["mMTC", "logistics", "asset-tracking", "Singapore"], "rationale": "This case concerns low-power trackers on containers and pallets that send infrequent location updates. Such sparse, low-volume traffic is characteristic of mMTC, so serviceType='mMTC' and sliceType='mMTC-LogisticsTracking' are selected. Latency <151ms is non-critical because logistics can tolerate delayed visibility, and throughput 0.09Mbps matches small GPS reports. Reliability 97.73% is acceptable when occasional missed updates are compensated by later ones. Region 'Singapore' and time '2025-04-09' follow the logistics operation, and priority '5' expresses a lower priority appropriate for delay-tolerant background services relative to interactive applications."}
{"id": "KB-mMTC-008", "nl_intent": "Industrial park in Nanjing plans dense deployment of environmental sensors on 2025-05-05 to monitor air quality, temperature and humidity in real time.", "target_json": {"serviceType": "mMTC", "sliceType": "mMTC-EnvironmentalSensing", "latency": "<101ms", "throughput": "0.55Mbps", "region": "Nanjing", "reliability": "99.18%", "priority": "5", "time": "2025-05-05"}, "tags": ["mMTC", "environment", "sensing", "Nanjing"], "rationale": "The described deployment uses dense environmental sensors in an industrial park, measuring air quality, temperature and humidity. Despite 'real-time' wording, the data volume per device is small, so serviceType='mMTC' and sliceType='mMTC-EnvironmentalSensing' are chosen. Latency <101ms is still on the order of hundreds of milliseconds, which is enough for monitoring dashboards, and throughput 0.55Mbps fits continuous but low-rate measurements. Reliability 99.18% balances cost and sensing accuracy. Region 'Nanjing' and time '2025-05-05' come from the monitoring plan, and priority '5' indicates a lower priority appropriate for delay-tolerant background services compared with strict QoS slices."}
{"id": "KB-mMTC-009", "nl_intent": "Smart agriculture project outside Tokyo from 2025-04-28 will connect soil moisture sensors and climate stations across large fields.", "target_json": {"serviceType": "mMTC", "sliceType": "mMTC-Agriculture", "latency": "<105ms", "throughput": "0.36Mbps", "region": "Tokyo", "reliability": "96.82%", "priority": "5", "time": "2025-04-28"}, "tags": ["mMTC", "agriculture", "sensor-network", "Tokyo"], "rationale": "The scenario is a smart agriculture deployment with soil and climate sensors spread over large fields. These devices send low-rate measurements, making serviceType='mMTC' with sliceType='mMTC-Agriculture' a natural choice. Latency <105ms can be high because farming decisions are not made in milliseconds, and throughput 0.36Mbps corresponds to sporadic sensor updates. Reliability 96.82% is sufficient when multiple readings over time are available. Region 'Tokyo' and time '2025-04-28' represent the farming area and start date, and priority '5' reflects a lower priority appropriate for delay-tolerant background services compared to human-centric services."}
{"id": "KB-mMTC-010", "nl_intent": "Logistics company in Hangzhou will attach low-power trackers to thousands of containers and pallets from 2025-03-31, sending infrequent location updates.", "target_json": {"serviceType": "mMTC", "sliceType": "mMTC-LogisticsTracking", "latency": "<105ms", "throughput": "0.38Mbps", "region": "Hangzhou", "reliability": "98.35%", "priority": "5", "time": "2025-03-31"}, "tags": ["mMTC", "logistics", "asset-tracking", "Hangzhou"], "rationale": "This case concerns low-power trackers on containers and pallets that send infrequent location updates. Such sparse, low-volume traffic is characteristic of mMTC, so serviceType='mMTC' and sliceType='mMTC-LogisticsTracking' are selected. Latency <105ms is non-critical because logistics can tolerate delayed visibility, and throughput 0.38Mbps matches small GPS reports. Reliability 98.35% is acceptable when occasional missed updates are compensated by later ones. Region 'Hangzhou' and time '2025-03-31' follow the logistics operation, and priority '5' expresses a lower priority appropriate for delay-tolerant background services relative to interactive applications."}
{"id": "KB-mMTC-011", "nl_intent": "Industrial park in Nanjing plans dense deployment of environmental sensors on 2025-04-25 to monitor air quality, temperature and humidity in real time.", "target_json": {"serviceType": "mMTC", "sliceType": "mMTC-EnvironmentalSensing", "latency": "<102ms", "throughput": "0.82Mbps", "region": "Nanjing", "reliability": "98.00%", "priority": "4", "time": "2025-04-25"}, "tags": ["mMTC", "environment", "sensing", "Nanjing"], "rationale": "The described deployment uses dense environmental sensors in an industrial park, measuring air quality, temperature and humidity. Despite 'real-time' wording, the data volume per device is small, so serviceType='mMTC' and sliceType='mMTC-EnvironmentalSensing' are chosen. Latency <102ms is still on the order of hundreds of milliseconds, which is enough for monitoring dashboards, and throughput 0.82Mbps fits continuous but low-rate measurements. Reliability 98.00% balances cost and sensing accuracy. Region 'Nanjing' and time '2025-04-25' come from the monitoring plan, and priority '4' indicates a lower priority appropriate for delay-tolerant background services compared with strict QoS slices."}
{"id": "KB-mMTC-012", "nl_intent": "Urban smart parking system in Wuhan will deploy ground sensors and cameras starting 2025-01-05. Devices occasionally upload occupancy information.", "target_json": {"serviceType": "mMTC", "sliceType": "mMTC-SmartParking", "latency": "<114ms", "throughput": "0.35Mbps", "region": "Wuhan", "reliability": "97.69%", "priority": "5", "time": "2025-01-05"}, "tags": ["mMTC", "parking", "smart-city", "Wuhan"], "rationale": "The intent describes an urban smart parking system where sensors occasionally report whether spaces are occupied. This leads to serviceType='mMTC' and sliceType='mMTC-SmartParking', since message sizes are small and not time-critical to the millisecond. Latency <114ms allows for some delay before the app updates availability, and per-device throughput 0.35Mbps remains very low. Reliability 97.69% is adequate when parking status can be re-sent if needed. Region 'Wuhan' and time '2025-01-05' reference the city deployment, and priority '5' denotes a lower priority appropriate for delay-tolerant background services because these updates can yield to more urgent flows."}
{"id": "KB-mMTC-013", "nl_intent": "Industrial park in London plans dense deployment of environmental sensors on 2025-03-15 to monitor air quality, temperature and humidity in real time.", "target_json": {"serviceType": "mMTC", "sliceType": "mMTC-EnvironmentalSensing", "latency": "<86ms", "throughput": "0.85Mbps", "region": "London", "reliability": "99.50%", "priority": "5", "time": "2025-03-15"}, "tags": ["mMTC", "environment", "sensing", "London"], "rationale": "The described deployment uses dense environmental sensors in an industrial park, measuring air quality, temperature and humidity. Despite 'real-time' wording, the data volume per device is small, so serviceType='mMTC' and sliceType='mMTC-EnvironmentalSensing' are chosen. Latency <86ms is still on the order of hundreds of milliseconds, which is enough for monitoring dashboards, and throughput 0.85Mbps fits continuous but low-rate measurements. Reliability 99.50% balances cost and sensing accuracy. Region 'London' and time '2025-03-15' come from the monitoring plan, and priority '5' indicates a lower priority appropriate for delay-tolerant background services compared with strict QoS slices."}
{"id": "KB-mMTC-014", "nl_intent": "Urban smart parking system in Dubai will deploy ground sensors and cameras starting 2025-01-06. Devices occasionally upload occupancy information.", "target_json": {"serviceType": "mMTC", "sliceType": "mMTC-SmartParking", "latency": "<138ms", "throughput": "0.21Mbps", "region": "Dubai", "reliability": "95.36%", "priority": "3", "time": "2025-01-06"}, "tags": ["mMTC", "parking", "smart-city", "Dubai"], "rationale": "The intent describes an urban smart parking system where sensors occasionally report whether spaces are occupied. This leads to serviceType='mMTC' and sliceType='mMTC-SmartParking', since message sizes are small and not time-critical to the millisecond. Latency <138ms allows for some delay before the app updates availability, and per-device throughput 0.21Mbps remains very low. Reliability 95.36% is adequate when parking status can be re-sent if needed. Region 'Dubai' and time '2025-01-06' reference the city deployment, and priority '3' denotes a medium priority suitable for ordinary services because these updates can yield to more urgent flows."}
{"id": "KB-mMTC-015", "nl_intent": "City-wide smart metering rollout in Xi'an starting 2025-01-30 will connect tens of thousands of electricity meters. Each meter periodically reports consumption data.", "target_json": {"serviceType": "mMTC", "sliceType": "mMTC-SmartMetering", "latency": "<172ms", "throughput": "0.07Mbps", "region": "Xi'an", "reliability": "98.87%", "priority": "5", "time": "2025-01-30"}, "tags": ["mMTC", "smart-meter", "utility", "AMI", "Xi'an"], "rationale": "This intent covers a smart metering rollout with tens of thousands of electricity meters sending periodic reports. The traffic consists of small, delay-tolerant packets, so the service is mapped to serviceType='mMTC' and sliceType='mMTC-SmartMetering'. Latency <172ms is relaxed because a delay of seconds does not impact billing, while per-device throughput 0.07Mbps matches occasional meter readings. Reliability 98.87% is adequate when combined with retransmissions over many reporting intervals. Region 'Xi'an' and time '2025-01-30' follow the city-wide deployment plan, and priority '5' expresses a lower priority appropriate for delay-tolerant background services since this telemetry can be deferred behind more urgent traffic."}
{"id": "KB-mMTC-016", "nl_intent": "Logistics company in Xi'an will attach low-power trackers to thousands of containers and pallets from 2025-04-07, sending infrequent location updates.", "target_json": {"serviceType": "mMTC", "sliceType": "mMTC-LogisticsTracking", "latency": "<155ms", "throughput": "0.22Mbps", "region": "Xi'an", "reliability": "98.91%", "priority": "5", "time": "2025-04-07"}, "tags": ["mMTC", "logistics", "asset-tracking", "Xi'an"], "rationale": "This case concerns low-power trackers on containers and pallets that send infrequent location updates. Such sparse, low-volume traffic is characteristic of mMTC, so serviceType='mMTC' and sliceType='mMTC-LogisticsTracking' are selected. Latency <155ms is non-critical because logistics can tolerate delayed visibility, and throughput 0.22Mbps matches small GPS reports. Reliability 98.91% is acceptable when occasional missed updates are compensated by later ones. Region 'Xi'an' and time '2025-04-07' follow the logistics operation, and priority '5' expresses a lower priority appropriate for delay-tolerant background services relative to interactive applications."}
{"id": "KB-mMTC-017", "nl_intent": "Logistics company in Bangkok will attach low-power trackers to thousands of containers and pallets from 2025-01-16, sending infrequent location updates.", "target_json": {"serviceType": "mMTC", "sliceType": "mMTC-LogisticsTracking", "latency": "<102ms", "throughput": "0.08Mbps", "region": "Bangkok", "reliability": "98.55%", "priority": "5", "time": "2025-01-16"}, "tags": ["mMTC", "logistics", "asset-tracking", "Bangkok"], "rationale": "This case concerns low-power trackers on containers and pallets that send infrequent location updates. Such sparse, low-volume traffic is characteristic of mMTC, so serviceType='mMTC' and sliceType='mMTC-LogisticsTracking' are selected. Latency <102ms is non-critical because logistics can tolerate delayed visibility, and throughput 0.08Mbps matches small GPS reports. Reliability 98.55% is acceptable when occasional missed updates are compensated by later ones. Region 'Bangkok' and time '2025-01-16' follow the logistics operation, and priority '5' expresses a lower priority appropriate for delay-tolerant background services relative to interactive applications."}
{"id": "KB-mMTC-018", "nl_intent": "Smart agriculture project outside Shenzhen from 2025-01-14 will connect soil moisture sensors and climate stations across large fields.", "target_json": {"serviceType": "mMTC", "sliceType": "mMTC-Agriculture", "latency": "<104ms", "throughput": "0.15Mbps", "region": "Shenzhen", "reliability": "96.22%", "priority": "4", "time": "2025-01-14"}, "tags": ["mMTC", "agriculture", "sensor-network", "Shenzhen"], "rationale": "The scenario is a smart agriculture deployment with soil and climate sensors spread over large fields. These devices send low-rate measurements, making serviceType='mMTC' with sliceType='mMTC-Agriculture' a natural choice. Latency <104ms can be high because farming decisions are not made in milliseconds, and throughput 0.15Mbps corresponds to sporadic sensor updates. Reliability 96.22% is sufficient when multiple readings over time are available. Region 'Shenzhen' and time '2025-01-14' represent the farming area and start date, and priority '4' reflects a lower priority appropriate for delay-tolerant background services compared to human-centric services."}
{"id": "KB-mMTC-019", "nl_intent": "Logistics company in Bangkok will attach low-power trackers to thousands of containers and pallets from 2025-03-10, sending infrequent location updates.", "target_json": {"serviceType": "mMTC", "sliceType": "mMTC-LogisticsTracking", "latency": "<177ms", "throughput": "0.20Mbps", "region": "Bangkok", "reliability": "98.30%", "priority": "3", "time": "2025-03-10"}, "tags": ["mMTC", "logistics", "asset-tracking", "Bangkok"], "rationale": "This case concerns low-power trackers on containers and pallets that send infrequent location updates. Such sparse, low-volume traffic is characteristic of mMTC, so serviceType='mMTC' and sliceType='mMTC-LogisticsTracking' are selected. Latency <177ms is non-critical because logistics can tolerate delayed visibility, and throughput 0.20Mbps matches small GPS reports. Reliability 98.30% is acceptable when occasional missed updates are compensated by later ones. Region 'Bangkok' and time '2025-03-10' follow the logistics operation, and priority '3' expresses a medium priority suitable for ordinary services relative to interactive applications."}
{"id": "KB-mMTC-020", "nl_intent": "Logistics company in Singapore will attach low-power trackers to thousands of containers and pallets from 2025-05-13, sending infrequent location updates.", "target_json": {"serviceType": "mMTC", "sliceType": "mMTC-LogisticsTracking", "latency": "<150ms", "throughput": "0.05Mbps", "region": "Singapore", "reliability": "98.97%", "priority": "4", "time": "2025-05-13"}, "tags": ["mMTC", "logistics", "asset-tracking", "Singapore"], "rationale": "This case concerns low-power trackers on containers and pallets that send infrequent location updates. Such sparse, low-volume traffic is characteristic of mMTC, so serviceType='mMTC' and sliceType='mMTC-LogisticsTracking' are selected. Latency <150ms is non-critical because logistics can tolerate delayed visibility, and throughput 0.05Mbps matches small GPS reports. Reliability 98.97% is acceptable when occasional missed updates are compensated by later ones. Region 'Singapore' and time '2025-05-13' follow the logistics operation, and priority '4' expresses a lower priority appropriate for delay-tolerant background services relative to interactive applications."}
{"id": "KB-mMTC-021", "nl_intent": "City-wide smart metering rollout in Suzhou starting 2025-05-04 will connect tens of thousands of electricity meters. Each meter periodically reports consumption data.", "target_json": {"serviceType": "mMTC", "sliceType": "mMTC-SmartMetering", "latency": "<163ms", "throughput": "0.08Mbps", "region": "Suzhou", "reliability": "96.42%", "priority": "3", "time": "2025-05-04"}, "tags": ["mMTC", "smart-meter", "utility", "AMI", "Suzhou"], "rationale": "This intent covers a smart metering rollout with tens of thousands of electricity meters sending periodic reports. The traffic consists of small, delay-tolerant packets, so the service is mapped to serviceType='mMTC' and sliceType='mMTC-SmartMetering'. Latency <163ms is relaxed because a delay of seconds does not impact billing, while per-device throughput 0.08Mbps matches occasional meter readings. Reliability 96.42% is adequate when combined with retransmissions over many reporting intervals. Region 'Suzhou' and time '2025-05-04' follow the city-wide deployment plan, and priority '3' expresses a medium priority suitable for ordinary services since this telemetry can be deferred behind more urgent traffic."}
{"id": "KB-mMTC-022", "nl_intent": "Logistics company in Singapore will attach low-power trackers to thousands of containers and pallets from 2025-01-11, sending infrequent location updates.", "target_json": {"serviceType": "mMTC", "sliceType": "mMTC-LogisticsTracking", "latency": "<178ms", "throughput": "0.34Mbps", "region": "Singapore", "reliability": "98.80%", "priority": "5", "time": "2025-01-11"}, "tags": ["mMTC", "logistics", "asset-tracking", "Singapore"], "rationale": "This case concerns low-power trackers on containers and pallets that send infrequent location updates. Such sparse, low-volume traffic is characteristic of mMTC, so serviceType='mMTC' and sliceType='mMTC-LogisticsTracking' are selected. Latency <178ms is non-critical because logistics can tolerate delayed visibility, and throughput 0.34Mbps matches small GPS reports. Reliability 98.80% is acceptable when occasional missed updates are compensated by later ones. Region 'Singapore' and time '2025-01-11' follow the logistics operation, and priority '5' expresses a lower priority appropriate for delay-tolerant background services relative to interactive applications."}
{"id": "KB-mMTC-023", "nl_intent": "City-wide smart metering rollout in Xi'an starting 2025-04-28 will connect tens of thousands of electricity meters. Each meter periodically reports consumption data.", "target_json": {"serviceType": "mMTC", "sliceType": "mMTC-SmartMetering", "latency": "<172ms", "throughput": "0.13Mbps", "region": "Xi'an", "reliability": "98.09%", "priority": "4", "time": "2025-04-28"}, "tags": ["mMTC", "smart-meter", "utility", "AMI", "Xi'an"], "rationale": "This intent covers a smart metering rollout with tens of thousands of electricity meters sending periodic reports. The traffic consists of small, delay-tolerant packets, so the service is mapped to serviceType='mMTC' and sliceType='mMTC-SmartMetering'. Latency <172ms is relaxed because a delay of seconds does not impact billing, while per-device throughput 0.13Mbps matches occasional meter readings. Reliability 98.09% is adequate when combined with retransmissions over many reporting intervals. Region 'Xi'an' and time '2025-04-28' follow the city-wide deployment plan, and priority '4' expresses a lower priority appropriate for delay-tolerant background services since this telemetry can be deferred behind more urgent traffic."}
{"id": "KB-mMTC-024", "nl_intent": "Industrial park in Beijing plans dense deployment of environmental sensors on 2025-03-10 to monitor air quality, temperature and humidity in real time.", "target_json": {"serviceType": "mMTC", "sliceType": "mMTC-EnvironmentalSensing", "latency": "<96ms", "throughput": "0.71Mbps", "region": "Beijing", "reliability": "97.30%", "priority": "3", "time": "2025-03-10"}, "tags": ["mMTC", "environment", "sensing", "Beijing"], "rationale": "The described deployment uses dense environmental sensors in an industrial park, measuring air quality, temperature and humidity. Despite 'real-time' wording, the data volume per device is small, so serviceType='mMTC' and sliceType='mMTC-EnvironmentalSensing' are chosen. Latency <96ms is still on the order of hundreds of milliseconds, which is enough for monitoring dashboards, and throughput 0.71Mbps fits continuous but low-rate measurements. Reliability 97.30% balances cost and sensing accuracy. Region 'Beijing' and time '2025-03-10' come from the monitoring plan, and priority '3' indicates a medium priority suitable for ordinary services compared with strict QoS slices."}
{"id": "KB-mMTC-025", "nl_intent": "Urban smart parking system in Dubai will deploy ground sensors and cameras starting 2025-03-11. Devices occasionally upload occupancy information.", "target_json": {"serviceType": "mMTC", "sliceType": "mMTC-SmartParking", "latency": "<176ms", "throughput": "0.21Mbps", "region": "Dubai", "reliability": "99.14%", "priority": "3", "time": "2025-03-11"}, "tags": ["mMTC", "parking", "smart-city", "Dubai"], "rationale": "The intent describes an urban smart parking system where sensors occasionally report whether spaces are occupied. This leads to serviceType='mMTC' and sliceType='mMTC-SmartParking', since message sizes are small and not time-critical to the millisecond. Latency <176ms allows for some delay before the app updates availability, and per-device throughput 0.21Mbps remains very low. Reliability 99.14% is adequate when parking status can be re-sent if needed. Region 'Dubai' and time '2025-03-11' reference the city deployment, and priority '3' denotes a medium priority suitable for ordinary services because these updates can yield to more urgent flows."}
{"id": "KB-mMTC-026", "nl_intent": "Industrial park in Shenzhen plans dense deployment of environmental sensors on 2025-05-07 to monitor air quality, temperature and humidity in real time.", "target_json": {"serviceType": "mMTC", "sliceType": "mMTC-EnvironmentalSensing", "latency": "<175ms", "throughput": "0.91Mbps", "region": "Shenzhen", "reliability": "98.58%", "priority": "3", "time": "2025-05-07"}, "tags": ["mMTC", "environment", "sensing", "Shenzhen"], "rationale": "The described deployment uses dense environmental sensors in an industrial park, measuring air quality, temperature and humidity. Despite 'real-time' wording, the data volume per device is small, so serviceType='mMTC' and sliceType='mMTC-EnvironmentalSensing' are chosen. Latency <175ms is still on the order of hundreds of milliseconds, which is enough for monitoring dashboards, and throughput 0.91Mbps fits continuous but low-rate measurements. Reliability 98.58% balances cost and sensing accuracy. Region 'Shenzhen' and time '2025-05-07' come from the monitoring plan, and priority '3' indicates a medium priority suitable for ordinary services compared with strict QoS slices."}
{"id": "KB-mMTC-027", "nl_intent": "City-wide smart metering rollout in Chengdu starting 2025-03-21 will connect tens of thousands of electricity meters. Each meter periodically reports consumption data.", "target_json": {"serviceType": "mMTC", "sliceType": "mMTC-SmartMetering", "latency": "<108ms", "throughput": "0.19Mbps", "region": "Chengdu", "reliability": "98.95%", "priority": "5", "time": "2025-03-21"}, "tags": ["mMTC", "smart-meter", "utility", "AMI", "Chengdu"], "rationale": "This intent covers a smart metering rollout with tens of thousands of electricity meters sending periodic reports. The traffic consists of small, delay-tolerant packets, so the service is mapped to serviceType='mMTC' and sliceType='mMTC-SmartMetering'. Latency <108ms is relaxed because a delay of seconds does not impact billing, while per-device throughput 0.19Mbps matches occasional meter readings. Reliability 98.95% is adequate when combined with retransmissions over many reporting intervals. Region 'Chengdu' and time '2025-03-21' follow the city-wide deployment plan, and priority '5' expresses a lower priority appropriate for delay-tolerant background services since this telemetry can be deferred behind more urgent traffic."}
{"id": "KB-mMTC-028", "nl_intent": "Logistics company in Singapore will attach low-power trackers to thousands of containers and pallets from 2025-01-23, sending infrequent location updates.", "target_json": {"serviceType": "mMTC", "sliceType": "mMTC-LogisticsTracking", "latency": "<106ms", "throughput": "0.33Mbps", "region": "Singapore", "reliability": "95.17%", "priority": "5", "time": "2025-01-23"}, "tags": ["mMTC", "logistics", "asset-tracking", "Singapore"], "rationale": "This case concerns low-power trackers on containers and pallets that send infrequent location updates. Such sparse, low-volume traffic is characteristic of mMTC, so serviceType='mMTC' and sliceType='mMTC-LogisticsTracking' are selected. Latency <106ms is non-critical because logistics can tolerate delayed visibility, and throughput 0.33Mbps matches small GPS reports. Reliability 95.17% is acceptable when occasional missed updates are compensated by later ones. Region 'Singapore' and time '2025-01-23' follow the logistics operation, and priority '5' expresses a lower priority appropriate for delay-tolerant background services relative to interactive applications."}
{"id": "KB-mMTC-029", "nl_intent": "Smart agriculture project outside Singapore from 2025-01-08 will connect soil moisture sensors and climate stations across large fields.", "target_json": {"serviceType": "mMTC", "sliceType": "mMTC-Agriculture", "latency": "<140ms", "throughput": "0.16Mbps", "region": "Singapore", "reliability": "99.26%", "priority": "3", "time": "2025-01-08"}, "tags": ["mMTC", "agriculture", "sensor-network", "Singapore"], "rationale": "The scenario is a smart agriculture deployment with soil and climate sensors spread over large fields. These devices send low-rate measurements, making serviceType='mMTC' with sliceType='mMTC-Agriculture' a natural choice. Latency <140ms can be high because farming decisions are not made in milliseconds, and throughput 0.16Mbps corresponds to sporadic sensor updates. Reliability 99.26% is sufficient when multiple readings over time are available. Region 'Singapore' and time '2025-01-08' represent the farming area and start date, and priority '3' reflects a medium priority suitable for ordinary services compared to human-centric services."}
{"id": "KB-mMTC-030", "nl_intent": "Urban smart parking system in Tianjin will deploy ground sensors and cameras starting 2025-03-18. Devices occasionally upload occupancy information.", "target_json": {"serviceType": "mMTC", "sliceType": "mMTC-SmartParking", "latency": "<141ms", "throughput": "0.06Mbps", "region": "Tianjin", "reliability": "95.45%", "priority": "3", "time": "2025-03-18"}, "tags": ["mMTC", "parking", "smart-city", "Tianjin"], "rationale": "The intent describes an urban smart parking system where sensors occasionally report whether spaces are occupied. This leads to serviceType='mMTC' and sliceType='mMTC-SmartParking', since message sizes are small and not time-critical to the millisecond. Latency <141ms allows for some delay before the app updates availability, and per-device throughput 0.06Mbps remains very low. Reliability 95.45% is adequate when parking status can be re-sent if needed. Region 'Tianjin' and time '2025-03-18' reference the city deployment, and priority '3' denotes a medium priority suitable for ordinary services because these updates can yield to more urgent flows."}
{"id": "KB-mMTC-031", "nl_intent": "City-wide smart metering rollout in Beijing starting 2025-01-01 will connect tens of thousands of electricity meters. Each meter periodically reports consumption data.", "target_json": {"serviceType": "mMTC", "sliceType": "mMTC-SmartMetering", "latency": "<162ms", "throughput": "0.40Mbps", "region": "Beijing", "reliability": "97.20%", "priority": "3", "time": "2025-01-01"}, "tags": ["mMTC", "smart-meter", "utility", "AMI", "Beijing"], "rationale": "This intent covers a smart metering rollout with tens of thousands of electricity meters sending periodic reports. The traffic consists of small, delay-tolerant packets, so the service is mapped to serviceType='mMTC' and sliceType='mMTC-SmartMetering'. Latency <162ms is relaxed because a delay of seconds does not impact billing, while per-device throughput 0.40Mbps matches occasional meter readings. Reliability 97.20% is adequate when combined with retransmissions over many reporting intervals. Region 'Beijing' and time '2025-01-01' follow the city-wide deployment plan, and priority '3' expresses a medium priority suitable for ordinary services since this telemetry can be deferred behind more urgent traffic."}
{"id": "KB-mMTC-032", "nl_intent": "Industrial park in Bangkok plans dense deployment of environmental sensors on 2025-04-29 to monitor air quality, temperature and humidity in real time.", "target_json": {"serviceType": "mMTC", "sliceType": "mMTC-EnvironmentalSensing", "latency": "<107ms", "throughput": "0.16Mbps", "region": "Bangkok", "reliability": "98.82%", "priority": "4", "time": "2025-04-29"}, "tags": ["mMTC", "environment", "sensing", "Bangkok"], "rationale": "The described deployment uses dense environmental sensors in an industrial park, measuring air quality, temperature and humidity. Despite 'real-time' wording, the data volume per device is small, so serviceType='mMTC' and sliceType='mMTC-EnvironmentalSensing' are chosen. Latency <107ms is still on the order of hundreds of milliseconds, which is enough for monitoring dashboards, and throughput 0.16Mbps fits continuous but low-rate measurements. Reliability 98.82% balances cost and sensing accuracy. Region 'Bangkok' and time '2025-04-29' come from the monitoring plan, and priority '4' indicates a lower priority appropriate for delay-tolerant background services compared with strict QoS slices."}
{"id": "KB-mMTC-033", "nl_intent": "Industrial park in Tokyo plans dense deployment of environmental sensors on 2025-02-27 to monitor air quality, temperature and humidity in real time.", "target_json": {"serviceType": "mMTC", "sliceType": "mMTC-EnvironmentalSensing", "latency": "<180ms", "throughput": "0.08Mbps", "region": "Tokyo", "reliability": "96.41%", "priority": "3", "time": "2025-02-27"}, "tags": ["mMTC", "environment", "sensing", "Tokyo"], "rationale": "The described deployment uses dense environmental sensors in an industrial park, measuring air quality, temperature and humidity. Despite 'real-time' wording, the data volume per device is small, so serviceType='mMTC' and sliceType='mMTC-EnvironmentalSensing' are chosen. Latency <180ms is still on the order of hundreds of milliseconds, which is enough for monitoring dashboards, and throughput 0.08Mbps fits continuous but low-rate measurements. Reliability 96.41% balances cost and sensing accuracy. Region 'Tokyo' and time '2025-02-27' come from the monitoring plan, and priority '3' indicates a medium priority suitable for ordinary services compared with strict QoS slices."}
{"id": "KB-mMTC-034", "nl_intent": "Industrial park in Tokyo plans dense deployment of environmental sensors on 2025-03-18 to monitor air quality, temperature and humidity in real time.", "target_json": {"serviceType": "mMTC", "sliceType": "mMTC-EnvironmentalSensing", "latency": "<136ms", "throughput": "0.53Mbps", "region": "Tokyo", "reliability": "95.37%", "priority": "4", "time": "2025-03-18"}, "tags": ["mMTC", "environment", "sensing", "Tokyo"], "rationale": "The described deployment uses dense environmental sensors in an industrial park, measuring air quality, temperature and humidity. Despite 'real-time' wording, the data volume per device is small, so serviceType='mMTC' and sliceType='mMTC-EnvironmentalSensing' are chosen. Latency <136ms is still on the order of hundreds of milliseconds, which is enough for monitoring dashboards, and throughput 0.53Mbps fits continuous but low-rate measurements. Reliability 95.37% balances cost and sensing accuracy. Region 'Tokyo' and time '2025-03-18' come from the monitoring plan, and priority '4' indicates a lower priority appropriate for delay-tolerant background services compared with strict QoS slices."}
{"id": "KB-mMTC-035", "nl_intent": "Smart agriculture project outside Dubai from 2025-05-15 will connect soil moisture sensors and climate stations across large fields.", "target_json": {"serviceType": "mMTC", "sliceType": "mMTC-Agriculture", "latency": "<154ms", "throughput": "0.29Mbps", "region": "Dubai", "reliability": "96.74%", "priority": "5", "time": "2025-05-15"}, "tags": ["mMTC", "agriculture", "sensor-network", "Dubai"], "rationale": "The scenario is a smart agriculture deployment with soil and climate sensors spread over large fields. These devices send low-rate measurements, making serviceType='mMTC' with sliceType='mMTC-Agriculture' a natural choice. Latency <154ms can be high because farming decisions are not made in milliseconds, and throughput 0.29Mbps corresponds to sporadic sensor updates. Reliability 96.74% is sufficient when multiple readings over time are available. Region 'Dubai' and time '2025-05-15' represent the farming area and start date, and priority '5' reflects a lower priority appropriate for delay-tolerant background services compared to human-centric services."}
{"id": "KB-mMTC-036", "nl_intent": "Urban smart parking system in Seoul will deploy ground sensors and cameras starting 2025-05-13. Devices occasionally upload occupancy information.", "target_json": {"serviceType": "mMTC", "sliceType": "mMTC-SmartParking", "latency": "<169ms", "throughput": "0.59Mbps", "region": "Seoul", "reliability": "95.57%", "priority": "5", "time": "2025-05-13"}, "tags": ["mMTC", "parking", "smart-city", "Seoul"], "rationale": "The intent describes an urban smart parking system where sensors occasionally report whether spaces are occupied. This leads to serviceType='mMTC' and sliceType='mMTC-SmartParking', since message sizes are small and not time-critical to the millisecond. Latency <169ms allows for some delay before the app updates availability, and per-device throughput 0.59Mbps remains very low. Reliability 95.57% is adequate when parking status can be re-sent if needed. Region 'Seoul' and time '2025-05-13' reference the city deployment, and priority '5' denotes a lower priority appropriate for delay-tolerant background services because these updates can yield to more urgent flows."}
{"id": "KB-mMTC-037", "nl_intent": "Smart agriculture project outside Beijing from 2025-01-05 will connect soil moisture sensors and climate stations across large fields.", "target_json": {"serviceType": "mMTC", "sliceType": "mMTC-Agriculture", "latency": "<105ms", "throughput": "0.75Mbps", "region": "Beijing", "reliability": "99.49%", "priority": "5", "time": "2025-01-05"}, "tags": ["mMTC", "agriculture", "sensor-network", "Beijing"], "rationale": "The scenario is a smart agriculture deployment with soil and climate sensors spread over large fields. These devices send low-rate measurements, making serviceType='mMTC' with sliceType='mMTC-Agriculture' a natural choice. Latency <105ms can be high because farming decisions are not made in milliseconds, and throughput 0.75Mbps corresponds to sporadic sensor updates. Reliability 99.49% is sufficient when multiple readings over time are available. Region 'Beijing' and time '2025-01-05' represent the farming area and start date, and priority '5' reflects a lower priority appropriate for delay-tolerant background services compared to human-centric services."}
{"id": "KB-mMTC-038", "nl_intent": "Urban smart parking system in Suzhou will deploy ground sensors and cameras starting 2025-04-04. Devices occasionally upload occupancy information.", "target_json": {"serviceType": "mMTC", "sliceType": "mMTC-SmartParking", "latency": "<148ms", "throughput": "0.39Mbps", "region": "Suzhou", "reliability": "98.56%", "priority": "4", "time": "2025-04-04"}, "tags": ["mMTC", "parking", "smart-city", "Suzhou"], "rationale": "The intent describes an urban smart parking system where sensors occasionally report whether spaces are occupied. This leads to serviceType='mMTC' and sliceType='mMTC-SmartParking', since message sizes are small and not time-critical to the millisecond. Latency <148ms allows for some delay before the app updates availability, and per-device throughput 0.39Mbps remains very low. Reliability 98.56% is adequate when parking status can be re-sent if needed. Region 'Suzhou' and time '2025-04-04' reference the city deployment, and priority '4' denotes a lower priority appropriate for delay-tolerant background services because these updates can yield to more urgent flows."}
{"id": "KB-mMTC-039", "nl_intent": "Smart agriculture project outside Shanghai from 2025-03-07 will connect soil moisture sensors and climate stations across large fields.", "target_json": {"serviceType": "mMTC", "sliceType": "mMTC-Agriculture", "latency": "<193ms", "throughput": "0.68Mbps", "region": "Shanghai", "reliability": "95.24%", "priority": "5", "time": "2025-03-07"}, "tags": ["mMTC", "agriculture", "sensor-network", "Shanghai"], "rationale": "The scenario is a smart agriculture deployment with soil and climate sensors spread over large fields. These devices send low-rate measurements, making serviceType='mMTC' with sliceType='mMTC-Agriculture' a natural choice. Latency <193ms can be high because farming decisions are not made in milliseconds, and throughput 0.68Mbps corresponds to sporadic sensor updates. Reliability 95.24% is sufficient when multiple readings over time are available. Region 'Shanghai' and time '2025-03-07' represent the farming area and start date, and priority '5' reflects a lower priority appropriate for delay-tolerant background services compared to human-centric services."}
{"id": "KB-mMTC-040", "nl_intent": "Smart agriculture project outside Dubai from 2025-04-21 will connect soil moisture sensors and climate stations across large fields.", "target_json": {"serviceType": "mMTC", "sliceType": "mMTC-Agriculture", "latency": "<181ms", "throughput": "0.57Mbps", "region": "Dubai", "reliability": "98.19%", "priority": "4", "time": "2025-04-21"}, "tags": ["mMTC", "agriculture", "sensor-network", "Dubai"], "rationale": "The scenario is a smart agriculture deployment with soil and climate sensors spread over large fields. These devices send low-rate measurements, making serviceType='mMTC' with sliceType='mMTC-Agriculture' a natural choice. Latency <181ms can be high because farming decisions are not made in milliseconds, and throughput 0.57Mbps corresponds to sporadic sensor updates. Reliability 98.19% is sufficient when multiple readings over time are available. Region 'Dubai' and time '2025-04-21' represent the farming area and start date, and priority '4' reflects a lower priority appropriate for delay-tolerant background services compared to human-centric services."}
{"id": "KB-mMTC-041", "nl_intent": "City-wide smart metering rollout in Wuhan starting 2025-05-24 will connect tens of thousands of electricity meters. Each meter periodically reports consumption data.", "target_json": {"serviceType": "mMTC", "sliceType": "mMTC-SmartMetering", "latency": "<187ms", "throughput": "0.24Mbps", "region": "Wuhan", "reliability": "97.72%", "priority": "4", "time": "2025-05-24"}, "tags": ["mMTC", "smart-meter", "utility", "AMI", "Wuhan"], "rationale": "This intent covers a smart metering rollout with tens of thousands of electricity meters sending periodic reports. The traffic consists of small, delay-tolerant packets, so the service is mapped to serviceType='mMTC' and sliceType='mMTC-SmartMetering'. Latency <187ms is relaxed because a delay of seconds does not impact billing, while per-device throughput 0.24Mbps matches occasional meter readings. Reliability 97.72% is adequate when combined with retransmissions over many reporting intervals. Region 'Wuhan' and time '2025-05-24' follow the city-wide deployment plan, and priority '4' expresses a lower priority appropriate for delay-tolerant background services since this telemetry can be deferred behind more urgent traffic."}
{"id": "KB-mMTC-042", "nl_intent": "Smart agriculture project outside London from 2025-02-06 will connect soil moisture sensors and climate stations across large fields.", "target_json": {"serviceType": "mMTC", "sliceType": "mMTC-Agriculture", "latency": "<109ms", "throughput": "0.45Mbps", "region": "London", "reliability": "95.26%", "priority": "5", "time": "2025-02-06"}, "tags": ["mMTC", "agriculture", "sensor-network", "London"], "rationale": "The scenario is a smart agriculture deployment with soil and climate sensors spread over large fields. These devices send low-rate measurements, making serviceType='mMTC' with sliceType='mMTC-Agriculture' a natural choice. Latency <109ms can be high because farming decisions are not made in milliseconds, and throughput 0.45Mbps corresponds to sporadic sensor updates. Reliability 95.26% is sufficient when multiple readings over time are available. Region 'London' and time '2025-02-06' represent the farming area and start date, and priority '5' reflects a lower priority appropriate for delay-tolerant background services compared to human-centric services."}
{"id": "KB-mMTC-043", "nl_intent": "City-wide smart metering rollout in Wuhan starting 2025-04-06 will connect tens of thousands of electricity meters. Each meter periodically reports consumption data.", "target_json": {"serviceType": "mMTC", "sliceType": "mMTC-SmartMetering", "latency": "<196ms", "throughput": "0.40Mbps", "region": "Wuhan", "reliability": "96.03%", "priority": "5", "time": "2025-04-06"}, "tags": ["mMTC", "smart-meter", "utility", "AMI", "Wuhan"], "rationale": "This intent covers a smart metering rollout with tens of thousands of electricity meters sending periodic reports. The traffic consists of small, delay-tolerant packets, so the service is mapped to serviceType='mMTC' and sliceType='mMTC-SmartMetering'. Latency <196ms is relaxed because a delay of seconds does not impact billing, while per-device throughput 0.40Mbps matches occasional meter readings. Reliability 96.03% is adequate when combined with retransmissions over many reporting intervals. Region 'Wuhan' and time '2025-04-06' follow the city-wide deployment plan, and priority '5' expresses a lower priority appropriate for delay-tolerant background services since this telemetry can be deferred behind more urgent traffic."}
{"id": "KB-mMTC-044", "nl_intent": "Logistics company in Xi'an will attach low-power trackers to thousands of containers and pallets from 2025-03-24, sending infrequent location updates.", "target_json": {"serviceType": "mMTC", "sliceType": "mMTC-LogisticsTracking", "latency": "<147ms", "throughput": "0.49Mbps", "region": "Xi'an", "reliability": "98.89%", "priority": "4", "time": "2025-03-24"}, "tags": ["mMTC", "logistics", "asset-tracking", "Xi'an"], "rationale": "This case concerns low-power trackers on containers and pallets that send infrequent location updates. Such sparse, low-volume traffic is characteristic of mMTC, so serviceType='mMTC' and sliceType='mMTC-LogisticsTracking' are selected. Latency <147ms is non-critical because logistics can tolerate delayed visibility, and throughput 0.49Mbps matches small GPS reports. Reliability 98.89% is acceptable when occasional missed updates are compensated by later ones. Region 'Xi'an' and time '2025-03-24' follow the logistics operation, and priority '4' expresses a lower priority appropriate for delay-tolerant background services relative to interactive applications."}
{"id": "KB-mMTC-045", "nl_intent": "City-wide smart metering rollout in Nanjing starting 2025-05-14 will connect tens of thousands of electricity meters. Each meter periodically reports consumption data.", "target_json": {"serviceType": "mMTC", "sliceType": "mMTC-SmartMetering", "latency": "<139ms", "throughput": "0.25Mbps", "region": "Nanjing", "reliability": "97.18%", "priority": "5", "time": "2025-05-14"}, "tags": ["mMTC", "smart-meter", "utility", "AMI", "Nanjing"], "rationale": "This intent covers a smart metering rollout with tens of thousands of electricity meters sending periodic reports. The traffic consists of small, delay-tolerant packets, so the service is mapped to serviceType='mMTC' and sliceType='mMTC-SmartMetering'. Latency <139ms is relaxed because a delay of seconds does not impact billing, while per-device throughput 0.25Mbps matches occasional meter readings. Reliability 97.18% is adequate when combined with retransmissions over many reporting intervals. Region 'Nanjing' and time '2025-05-14' follow the city-wide deployment plan, and priority '5' expresses a lower priority appropriate for delay-tolerant background services since this telemetry can be deferred behind more urgent traffic."}
{"id": "KB-mMTC-046", "nl_intent": "Urban smart parking system in Tianjin will deploy ground sensors and cameras starting 2025-01-15. Devices occasionally upload occupancy information.", "target_json": {"serviceType": "mMTC", "sliceType": "mMTC-SmartParking", "latency": "<178ms", "throughput": "0.31Mbps", "region": "Tianjin", "reliability": "97.77%", "priority": "5", "time": "2025-01-15"}, "tags": ["mMTC", "parking", "smart-city", "Tianjin"], "rationale": "The intent describes an urban smart parking system where sensors occasionally report whether spaces are occupied. This leads to serviceType='mMTC' and sliceType='mMTC-SmartParking', since message sizes are small and not time-critical to the millisecond. Latency <178ms allows for some delay before the app updates availability, and per-device throughput 0.31Mbps remains very low. Reliability 97.77% is adequate when parking status can be re-sent if needed. Region 'Tianjin' and time '2025-01-15' reference the city deployment, and priority '5' denotes a lower priority appropriate for delay-tolerant background services because these updates can yield to more urgent flows."}
{"id": "KB-mMTC-047", "nl_intent": "Smart agriculture project outside Beijing from 2025-04-18 will connect soil moisture sensors and climate stations across large fields.", "target_json": {"serviceType": "mMTC", "sliceType": "mMTC-Agriculture", "latency": "<123ms", "throughput": "0.61Mbps", "region": "Beijing", "reliability": "96.58%", "priority": "4", "time": "2025-04-18"}, "tags": ["mMTC", "agriculture", "sensor-network", "Beijing"], "rationale": "The scenario is a smart agriculture deployment with soil and climate sensors spread over large fields. These devices send low-rate measurements, making serviceType='mMTC' with sliceType='mMTC-Agriculture' a natural choice. Latency <123ms can be high because farming decisions are not made in milliseconds, and throughput 0.61Mbps corresponds to sporadic sensor updates. Reliability 96.58% is sufficient when multiple readings over time are available. Region 'Beijing' and time '2025-04-18' represent the farming area and start date, and priority '4' reflects a lower priority appropriate for delay-tolerant background services compared to human-centric services."}
{"id": "KB-mMTC-048", "nl_intent": "Urban smart parking system in Chengdu will deploy ground sensors and cameras starting 2025-04-10. Devices occasionally upload occupancy information.", "target_json": {"serviceType": "mMTC", "sliceType": "mMTC-SmartParking", "latency": "<128ms", "throughput": "0.33Mbps", "region": "Chengdu", "reliability": "96.09%", "priority": "5", "time": "2025-04-10"}, "tags": ["mMTC", "parking", "smart-city", "Chengdu"], "rationale": "The intent describes an urban smart parking system where sensors occasionally report whether spaces are occupied. This leads to serviceType='mMTC' and sliceType='mMTC-SmartParking', since message sizes are small and not time-critical to the millisecond. Latency <128ms allows for some delay before the app updates availability, and per-device throughput 0.33Mbps remains very low. Reliability 96.09% is adequate when parking status can be re-sent if needed. Region 'Chengdu' and time '2025-04-10' reference the city deployment, and priority '5' denotes a lower priority appropriate for delay-tolerant background services because these updates can yield to more urgent flows."}
{"id": "KB-mMTC-049", "nl_intent": "City-wide smart metering rollout in Wuhan starting 2025-03-20 will connect tens of thousands of electricity meters. Each meter periodically reports consumption data.", "target_json": {"serviceType": "mMTC", "sliceType": "mMTC-SmartMetering", "latency": "<190ms", "throughput": "0.44Mbps", "region": "Wuhan", "reliability": "99.20%", "priority": "4", "time": "2025-03-20"}, "tags": ["mMTC", "smart-meter", "utility", "AMI", "Wuhan"], "rationale": "This intent covers a smart metering rollout with tens of thousands of electricity meters sending periodic reports. The traffic consists of small, delay-tolerant packets, so the service is mapped to serviceType='mMTC' and sliceType='mMTC-SmartMetering'. Latency <190ms is relaxed because a delay of seconds does not impact billing, while per-device throughput 0.44Mbps matches occasional meter readings. Reliability 99.20% is adequate when combined with retransmissions over many reporting intervals. Region 'Wuhan' and time '2025-03-20' follow the city-wide deployment plan, and priority '4' expresses a lower priority appropriate for delay-tolerant background services since this telemetry can be deferred behind more urgent traffic."}
{"id": "KB-mMTC-050", "nl_intent": "Smart agriculture project outside Chengdu from 2025-01-03 will connect soil moisture sensors and climate stations across large fields.", "target_json": {"serviceType": "mMTC", "sliceType": "mMTC-Agriculture", "latency": "<130ms", "throughput": "0.30Mbps", "region": "Chengdu", "reliability": "99.24%", "priority": "4", "time": "2025-01-03"}, "tags": ["mMTC", "agriculture", "sensor-network", "Chengdu"], "rationale": "The scenario is a smart agriculture deployment with soil and climate sensors spread over large fields. These devices send low-rate measurements, making serviceType='mMTC' with sliceType='mMTC-Agriculture' a natural choice. Latency <130ms can be high because farming decisions are not made in milliseconds, and throughput 0.30Mbps corresponds to sporadic sensor updates. Reliability 99.24% is sufficient when multiple readings over time are available. Region 'Chengdu' and time '2025-01-03' represent the farming area and start date, and priority '4' reflects a lower priority appropriate for delay-tolerant background services compared to human-centric services."}
{"id": "KB-mMTC-051", "nl_intent": "Logistics company in Seoul will attach low-power trackers to thousands of containers and pallets from 2025-01-15, sending infrequent location updates.", "target_json": {"serviceType": "mMTC", "sliceType": "mMTC-LogisticsTracking", "latency": "<101ms", "throughput": "0.26Mbps", "region": "Seoul", "reliability": "98.49%", "priority": "3", "time": "2025-01-15"}, "tags": ["mMTC", "logistics", "asset-tracking", "Seoul"], "rationale": "This case concerns low-power trackers on containers and pallets that send infrequent location updates. Such sparse, low-volume traffic is characteristic of mMTC, so serviceType='mMTC' and sliceType='mMTC-LogisticsTracking' are selected. Latency <101ms is non-critical because logistics can tolerate delayed visibility, and throughput 0.26Mbps matches small GPS reports. Reliability 98.49% is acceptable when occasional missed updates are compensated by later ones. Region 'Seoul' and time '2025-01-15' follow the logistics operation, and priority '3' expresses a medium priority suitable for ordinary services relative to interactive applications."}
{"id": "KB-mMTC-052", "nl_intent": "Urban smart parking system in Tianjin will deploy ground sensors and cameras starting 2025-01-31. Devices occasionally upload occupancy information.", "target_json": {"serviceType": "mMTC", "sliceType": "mMTC-SmartParking", "latency": "<151ms", "throughput": "0.43Mbps", "region": "Tianjin", "reliability": "96.50%", "priority": "5", "time": "2025-01-31"}, "tags": ["mMTC", "parking", "smart-city", "Tianjin"], "rationale": "The intent describes an urban smart parking system where sensors occasionally report whether spaces are occupied. This leads to serviceType='mMTC' and sliceType='mMTC-SmartParking', since message sizes are small and not time-critical to the millisecond. Latency <151ms allows for some delay before the app updates availability, and per-device throughput 0.43Mbps remains very low. Reliability 96.50% is adequate when parking status can be re-sent if needed. Region 'Tianjin' and time '2025-01-31' reference the city deployment, and priority '5' denotes a lower priority appropriate for delay-tolerant background services because these updates can yield to more urgent flows."}
{"id": "KB-mMTC-053", "nl_intent": "City-wide smart metering rollout in Shenzhen starting 2025-01-27 will connect tens of thousands of electricity meters. Each meter periodically reports consumption data.", "target_json": {"serviceType": "mMTC", "sliceType": "mMTC-SmartMetering", "latency": "<157ms", "throughput": "0.28Mbps", "region": "Shenzhen", "reliability": "97.34%", "priority": "3", "time": "2025-01-27"}, "tags": ["mMTC", "smart-meter", "utility", "AMI", "Shenzhen"], "rationale": "This intent covers a smart metering rollout with tens of thousands of electricity meters sending periodic reports. The traffic consists of small, delay-tolerant packets, so the service is mapped to serviceType='mMTC' and sliceType='mMTC-SmartMetering'. Latency <157ms is relaxed because a delay of seconds does not impact billing, while per-device throughput 0.28Mbps matches occasional meter readings. Reliability 97.34% is adequate when combined with retransmissions over many reporting intervals. Region 'Shenzhen' and time '2025-01-27' follow the city-wide deployment plan, and priority '3' expresses a medium priority suitable for ordinary services since this telemetry can be deferred behind more urgent traffic."}
{"id": "KB-mMTC-054", "nl_intent": "Industrial park in London plans dense deployment of environmental sensors on 2025-01-08 to monitor air quality, temperature and humidity in real time.", "target_json": {"serviceType": "mMTC", "sliceType": "mMTC-EnvironmentalSensing", "latency": "<129ms", "throughput": "0.89Mbps", "region": "London", "reliability": "98.04%", "priority": "4", "time": "2025-01-08"}, "tags": ["mMTC", "environment", "sensing", "London"], "rationale": "The described deployment uses dense environmental sensors in an industrial park, measuring air quality, temperature and humidity. Despite 'real-time' wording, the data volume per device is small, so serviceType='mMTC' and sliceType='mMTC-EnvironmentalSensing' are chosen. Latency <129ms is still on the order of hundreds of milliseconds, which is enough for monitoring dashboards, and throughput 0.89Mbps fits continuous but low-rate measurements. Reliability 98.04% balances cost and sensing accuracy. Region 'London' and time '2025-01-08' come from the monitoring plan, and priority '4' indicates a lower priority appropriate for delay-tolerant background services compared with strict QoS slices."}
{"id": "KB-mMTC-055", "nl_intent": "Smart agriculture project outside Dubai from 2025-05-13 will connect soil moisture sensors and climate stations across large fields.", "target_json": {"serviceType": "mMTC", "sliceType": "mMTC-Agriculture", "latency": "<103ms", "throughput": "0.68Mbps", "region": "Dubai", "reliability": "98.89%", "priority": "5", "time": "2025-05-13"}, "tags": ["mMTC", "agriculture", "sensor-network", "Dubai"], "rationale": "The scenario is a smart agriculture deployment with soil and climate sensors spread over large fields. These devices send low-rate measurements, making serviceType='mMTC' with sliceType='mMTC-Agriculture' a natural choice. Latency <103ms can be high because farming decisions are not made in milliseconds, and throughput 0.68Mbps corresponds to sporadic sensor updates. Reliability 98.89% is sufficient when multiple readings over time are available. Region 'Dubai' and time '2025-05-13' represent the farming area and start date, and priority '5' reflects a lower priority appropriate for delay-tolerant background services compared to human-centric services."}
{"id": "KB-mMTC-056", "nl_intent": "Smart agriculture project outside London from 2025-05-09 will connect soil moisture sensors and climate stations across large fields.", "target_json": {"serviceType": "mMTC", "sliceType": "mMTC-Agriculture", "latency": "<157ms", "throughput": "0.16Mbps", "region": "London", "reliability": "97.21%", "priority": "4", "time": "2025-05-09"}, "tags": ["mMTC", "agriculture", "sensor-network", "London"], "rationale": "The scenario is a smart agriculture deployment with soil and climate sensors spread over large fields. These devices send low-rate measurements, making serviceType='mMTC' with sliceType='mMTC-Agriculture' a natural choice. Latency <157ms can be high because farming decisions are not made in milliseconds, and throughput 0.16Mbps corresponds to sporadic sensor updates. Reliability 97.21% is sufficient when multiple readings over time are available. Region 'London' and time '2025-05-09' represent the farming area and start date, and priority '4' reflects a lower priority appropriate for delay-tolerant background services compared to human-centric services."}
{"id": "KB-mMTC-057", "nl_intent": "Smart agriculture project outside Bangkok from 2025-03-07 will connect soil moisture sensors and climate stations across large fields.", "target_json": {"serviceType": "mMTC", "sliceType": "mMTC-Agriculture", "latency": "<167ms", "throughput": "0.71Mbps", "region": "Bangkok", "reliability": "95.55%", "priority": "4", "time": "2025-03-07"}, "tags": ["mMTC", "agriculture", "sensor-network", "Bangkok"], "rationale": "The scenario is a smart agriculture deployment with soil and climate sensors spread over large fields. These devices send low-rate measurements, making serviceType='mMTC' with sliceType='mMTC-Agriculture' a natural choice. Latency <167ms can be high because farming decisions are not made in milliseconds, and throughput 0.71Mbps corresponds to sporadic sensor updates. Reliability 95.55% is sufficient when multiple readings over time are available. Region 'Bangkok' and time '2025-03-07' represent the farming area and start date, and priority '4' reflects a lower priority appropriate for delay-tolerant background services compared to human-centric services."}
{"id": "KB-mMTC-058", "nl_intent": "Logistics company in Tianjin will attach low-power trackers to thousands of containers and pallets from 2025-02-19, sending infrequent location updates.", "target_json": {"serviceType": "mMTC", "sliceType": "mMTC-LogisticsTracking", "latency": "<164ms", "throughput": "0.18Mbps", "region": "Tianjin", "reliability": "95.14%", "priority": "3", "time": "2025-02-19"}, "tags": ["mMTC", "logistics", "asset-tracking", "Tianjin"], "rationale": "This case concerns low-power trackers on containers and pallets that send infrequent location updates. Such sparse, low-volume traffic is characteristic of mMTC, so serviceType='mMTC' and sliceType='mMTC-LogisticsTracking' are selected. Latency <164ms is non-critical because logistics can tolerate delayed visibility, and throughput 0.18Mbps matches small GPS reports. Reliability 95.14% is acceptable when occasional missed updates are compensated by later ones. Region 'Tianjin' and time '2025-02-19' follow the logistics operation, and priority '3' expresses a medium priority suitable for ordinary services relative to interactive applications."}
{"id": "KB-mMTC-059", "nl_intent": "City-wide smart metering rollout in Guangzhou starting 2025-01-01 will connect tens of thousands of electricity meters. Each meter periodically reports consumption data.", "target_json": {"serviceType": "mMTC", "sliceType": "mMTC-SmartMetering", "latency": "<122ms", "throughput": "0.35Mbps", "region": "Guangzhou", "reliability": "98.60%", "priority": "5", "time": "2025-01-01"}, "tags": ["mMTC", "smart-meter", "utility", "AMI", "Guangzhou"], "rationale": "This intent covers a smart metering rollout with tens of thousands of electricity meters sending periodic reports. The traffic consists of small, delay-tolerant packets, so the service is mapped to serviceType='mMTC' and sliceType='mMTC-SmartMetering'. Latency <122ms is relaxed because a delay of seconds does not impact billing, while per-device throughput 0.35Mbps matches occasional meter readings. Reliability 98.60% is adequate when combined with retransmissions over many reporting intervals. Region 'Guangzhou' and time '2025-01-01' follow the city-wide deployment plan, and priority '5' expresses a lower priority appropriate for delay-tolerant background services since this telemetry can be deferred behind more urgent traffic."}
{"id": "KB-mMTC-060", "nl_intent": "Urban smart parking system in Singapore will deploy ground sensors and cameras starting 2025-04-30. Devices occasionally upload occupancy information.", "target_json": {"serviceType": "mMTC", "sliceType": "mMTC-SmartParking", "latency": "<113ms", "throughput": "0.54Mbps", "region": "Singapore", "reliability": "98.96%", "priority": "5", "time": "2025-04-30"}, "tags": ["mMTC", "parking", "smart-city", "Singapore"], "rationale": "The intent describes an urban smart parking system where sensors occasionally report whether spaces are occupied. This leads to serviceType='mMTC' and sliceType='mMTC-SmartParking', since message sizes are small and not time-critical to the millisecond. Latency <113ms allows for some delay before the app updates availability, and per-device throughput 0.54Mbps remains very low. Reliability 98.96% is adequate when parking status can be re-sent if needed. Region 'Singapore' and time '2025-04-30' reference the city deployment, and priority '5' denotes a lower priority appropriate for delay-tolerant background services because these updates can yield to more urgent flows."}
